publication_number,patent_citation,publication_date,assignee,title
EP2167136B1,US5766847A,1998-06-16,Max-Planck-Gesellschaft Zur Forderung Der Wissenschaften E.V.,Process for analyzing length polymorphisms in DNA regions
EP2167136B1,US6867195B1,2005-03-15,Vical Incorporated,Lipid-mediated polynucleotide administration to reduce likelihood of subject's becoming infected
EP2167136B1,US5608046A,1997-03-04,"Isis Pharmaceuticals, Inc.",Conjugated 4'-desmethyl nucleoside analog compounds
EP2167136B1,FR2675803B1,1996-09-06,Genset Sa,"CLOSED, ANTISENSE AND SENSE OLIGONUCLEOTIDES AND THEIR APPLICATIONS."
EP2167136B1,AU659482B2,1995-05-18,Massachusetts Institute Of Technology,Localized oligonucleotide therapy
EP2167136B1,CA2082411A1,1992-12-29,Robert D. Rosenberg,Localized oligonucleotide therapy
EP2167136B1,US6200747B1,2001-03-13,North Shore University Hospital Research Corp.,"Method and kits for detection of fragile X specific, GC-rich DNA sequences"
EP2167136B1,US5869252A,1999-02-09,Abbott Laboratories,Method of multiplex ligase chain reaction
EP2167136B1,US5418139A,1995-05-23,University Of Iowa Research Foundation,Method for screening for cardiomyopathy
EP2167136B1,CA2116280A1,1994-09-06,Marcy E. Macdonald,"Huntingtin dna, protein and uses thereof"
EP2167136B1,US5741645A,1998-04-21,Regents Of The University Of Minnesota,Gene sequence for spinocerebellar ataxia type 1 and method for diagnosis
EP2167136B1,US5627263A,1997-05-06,La Jolla Cancer Research Foundation,Integrin-binding peptides
EP2167136B1,DE4342605A1,1995-06-22,Buna Gmbh,Functionalized olefin homo- and copolymers
EP2167136B1,US5962332A,1999-10-05,University Of Massachusetts,Detection of trinucleotide repeats by in situ hybridization
EP2167136B1,EP0758403B1,1998-06-24,"Beckman Instruments, Inc.",Oligonucleotide repeat arrays
EP2167136B1,US5968909A,1999-10-19,"Hybridon, Inc.",Method of modulating gene expression with reduced immunostimulatory response
EP2167136B1,US5854223A,1998-12-29,The Trustees Of Columbia University In The City Of New York,S-DC28 as an antirestenosis agent after balloon injury
EP2167136B1,US6300060B1,2001-10-09,"Dana-Farber Cancer Institute, Inc.",Method for predicting the risk of prostate cancer morbidity and mortality
EP2167136B1,CN1214688A,1999-04-21,伊希斯药物有限公司,Sugar-modified gapped oligonucleotides
EP2167136B1,US20020137890A1,2002-09-26,"Genentech, Inc.",Secreted and transmembrane polypeptides and nucleic acids encoding the same
EP2167136B1,JP3950480B2,2007-08-01,株式会社エスアールエル,Method for detecting causal gene of spinocerebellar degeneration type 2 and primer therefor
EP2167136B1,CA2241173A1,1998-05-07,"Srl, Inc.",Cdna fragment of causative gene of spinocerebellar ataxia type 2
EP2167136B1,US5853995A,1998-12-29,Research Development Foundation,Large scale genotyping of diseases and a diagnostic test for spinocerebellar ataxia type 6
EP2167136B1,WO1998049345A1,1998-11-05,Trustees Of Boston University,Methods and compositions for targeted dna differential display
EP2167136B1,US6329501B1,2001-12-11,Auburn University,Methods and compositions for targeting compounds to muscle
EP2167136B1,US6514755B1,2003-02-04,Regents Of The University Of Minnesota,SCA7 gene and methods of use
EP2167136B1,US6280938B1,2001-08-28,Regents Of The University Of Minnesota,SCA7 gene and method of use
EP2167136B1,US6794499B2,2004-09-21,Exiqon A/S,Oligonucleotide analogues
EP2167136B1,US6130207A,2000-10-10,South Alabama Medical Science Foundation,Cell-specific molecule and method for importing DNA into a nucleus
EP2167136B1,US20030096955A1,2003-05-22,"Genentech, Inc.",Secreted and transmembrane polypeptides and nucleic acids encoding the same
EP2167136B1,JP3012923B2,2000-02-28,新潟大学長,Drug for treating CAG repeat disease
EP2167136B1,KR100280219B1,2001-04-02,이수빈,Diagnostic Method and Diagnostic Reagent of Neuropsychiatric Disease Using Trinucleic Acid Repeat Sequence
EP2167136B1,US6322978B1,2001-11-27,"Joslin Diabetes Center, Inc.",Repeat polymorphism in the frataxin gene and uses therefore
EP2167136B1,US20030236214A1,2003-12-25,Wolff Jon A.,Charge reversal of polyion complexes and treatment of peripheral occlusive disease
EP2167136B1,AU6059099A,2000-04-17,Children's Medical Center Corporation,Short peptides which selectively modulate the activity of protein kinases
EP2167136B1,US6172216B1,2001-01-09,Isis Pharmaceuticals Inc.,Antisense modulation of BCL-X expression
EP2167136B1,US20020049173A1,2002-04-25,Bennett C. Frank,Alteration of cellular behavior by antisense modulation of mRNA processing
EP2167136B1,US6399575B1,2002-06-04,Auburn University,Methods and compositions for targeting compounds to the central nervous system
EP2167136B1,US20040226056A1,2004-11-11,"Myriad Genetics, Incorporated",Compositions and methods for treating neurological disorders and diseases
EP2167136B1,US6379698B1,2002-04-30,"Isis Pharmaceuticals, Inc.",Fusogenic lipids and vesicles
EP2167136B1,JP2000325085A,2000-11-28,Masafumi Matsuo,Pharmaceutical composition for treatment of duchenne muscular dystrophy
EP2167136B1,AU5625500A,2001-01-09,Emory University,Huntington disease cellular model: stably transfected pc12 cells expressing mutant huntingtin
EP2167136B1,US6133031A,2000-10-17,Isis Pharmaceuticals Inc.,Antisense inhibition of focal adhesion kinase expression
EP2167136B1,EP1133993A1,2001-09-19,Max-Planck-Gesellschaft zur Förderung der Wissenschaften e.V.,Substances for the treatment of spinal muscular atrophy
EP2167136B1,US20020187931A1,2002-12-12,Michael Hayden,Modulating cell survival by modulating huntingtin function
EP2167136B1,US6653467B1,2003-11-25,"Jcr Pharmaceutical Co., Ltd.",Medicament for treatment of Duchenne muscular dystrophy
EP2167136B1,DE60139394D1,2009-09-10,Asklepios Biopharmaceutical In,DNA Sequencing Coding for the Dystrophin-Minigene and Method of Using the Same
EP2167136B1,US20020013287A1,2002-01-31,"Reliable Biopharmaceuticals, Inc. St Louis Missouri",Polymeric compounds useful as prodrugs
EP2167136B1,JP2003535104A,2003-11-25,ジェンセット,Use of an ACRP30 spherical head to promote increased muscle mass and muscle differentiation
EP2167136B1,US20030124523A1,2003-07-03,Asselbergs Fredericus Alphonsus Maria,Organic compounds
EP2167136B1,US6794192B2,2004-09-21,Pfizer Inc.,Target
EP2167136B1,RU2165149C1,2001-04-20,Шапошников Валерий Геннадьевич,"""sugar wool"" products forming and packaging method"
EP2167136B1,US6727355B2,2004-04-27,"Jcr Pharmaceuticals Co., Ltd.",Pharmaceutical composition for treatment of Duchenne muscular dystrophy
EP2167136B1,EP1191097A1,2002-03-27,Leids Universitair Medisch Centrum,Induction of exon skipping in eukaryotic cells
EP2167136B1,US6623927B1,2003-09-23,Council Of Scientific And Industrial Research,Method of detection of allelic variants of SCA2 gene
EP2167136B1,US6743893B2,2004-06-01,The Uab Research Foundation,Receptor-mediated uptake of peptides that bind the human transferrin receptor
EP2167136B1,US20030134790A1,2003-07-17,University Of Medicine And Dentistry Of New Jersey,Bone Morphogenetic Protein-2 And Bone Morphogenetic Protein-4 In The Treatment And Diagnosis Of Cancer
EP2167136B1,TWI329129B,2010-08-21,Wyeth Corp,Modified and stabilized gdf propeptides and uses thereof
EP2167136B1,CA2414782C,2012-10-09,Regents Of The University Of Minnesota,Intron associated with myotonic dystrophy type 2 and methods of use
EP2167136B1,US20050277133A1,2005-12-15,"Sirna Therapeutics, Inc.",RNA interference mediated treatment of polyglutamine (polyQ) repeat expansion diseases using short interfering nucleic acid (siNA)
EP2167136B1,US20050096284A1,2005-05-05,"Sirna Therapeutics, Inc.",RNA interference mediated treatment of polyglutamine (polyQ) repeat expansion diseases using short interfering nucleic acid (siNA)
EP2167136B1,AU2004266311B2,2009-07-23,"Sirna Therapeutics, Inc.",RNA interference mediated inhibition of gene expression using chemically modified short interfering nucleic acid (siNA)
EP2167136B1,EP1735443A2,2006-12-27,"Sirna Therapeutics, Inc.",RNA INTERFERENCE MEDIATED TREATMENT OF POLYGLUTAMINE (POLYQ) REPEAT EXPANSION DISEASES USING SHORT INTERFERING NUCLEIC ACID (siNA)
EP2167136B1,US20030109476A1,2003-06-12,Kmiec Eric B.,Compositions and methods for the prevention and treatment of Huntington's disease
EP2167136B1,US20060074034A1,2006-04-06,Collins Douglas A,"Cobalamin mediated delivery of nucleic acids, analogs and derivatives thereof"
EP2167136B1,KR20030035047A,2003-05-09,(주)바이오코돈,Use of BMP-4 gene and its gene product for treatment and diagnosis of Lichen Planus
EP2167136B1,WO2003037172A2,2003-05-08,Gpc Biotech Inc.,Endothelial-cell binding peptides for diagnosis and therapy
EP2167136B1,WO2003069330A1,2003-08-21,The Trustees Of Columbia University In The City Of New York,System and method for identifying proteins involved in force-initiated signal transduction
EP2167136B1,CN102133407A,2011-07-27,图兰恩教育基金管理人,Conjugates of therapeutic or cytotoxic agents and biologically active peptides
EP2167136B1,ITRM20020253A1,2003-11-10,Univ Roma,SNRNA CHEMICAL MOLECULES WITH ANTISENSE SEQUENCES FOR SPLICING JUNCTIONS OF THE DYSTROPHINE GENE AND THERAPEUTIC APPLICATIONS.
EP2167136B1,EP1380644A1,2004-01-14,Kylix B.V.,"The use of specified TCF target genes to identify drugs for the treatment of cancer, in particular colorectal cancer, in which TCF/beta-catenin/WNT signalling plays a central role"
EP2167136B1,WO2004011060A2,2004-02-05,Mirus Corporation,Delivery of molecules and complexes to mammalian cells in vivo
EP2167136B1,WO2006083800A2,2006-08-10,University Of Iowa Research Foundation,Nucleic acid silencing of huntington's disease gene
EP2167136B1,US20050255086A1,2005-11-17,Davidson Beverly L,Nucleic acid silencing of Huntington's Disease gene
EP2167136B1,AU2003282078A1,2004-02-25,Universite De Sherbrooke,Methods to reprogram splice site selection in pre-messenger rnas
EP2167136B1,GB0219143D0,2002-09-25,Univ Leicester,Modified tailed oligonucleotides
EP2167136B1,PT1554305E,2007-05-31,Ct For Res And Technology Hell,Prion protein-binding peptide sequences
EP2167136B1,US7892793B2,2011-02-22,University Of Massachusetts,Allele-specific RNA interference
EP2167136B1,DK2284266T3,2014-01-13,Thermo Fisher Scient Biosciences Inc,SIRNA MOLECULE MOD TP53
EP2167136B1,US20040101852A1,2004-05-27,Isis Pharmaceuticals Inc.,Modulation of CGG triplet repeat binding protein 1 expression
EP2167136B1,EP2374885A3,2012-02-15,Masafumi Matsuo,ENA nucleic acid drugs modifying splicing in mRNA precursor
EP2167136B1,GB0228079D0,2003-01-08,Laxdale Ltd,Huntington's Disease
EP2167136B1,WO2004083432A1,2004-09-30,Academisch Ziekenhuis Leiden,Modulation of exon recognition in pre-mrna by interfering with the secondary rna structure
EP2167136B1,AU2004239114B2,2008-03-13,Japan Science And Technology Agency,Inhibition of the expression of huntingtin gene
EP2167136B1,JP5110877B2,2012-12-26,ワイス・エルエルシー,Use of myostatin (GDF8) inhibitors in combination with corticosteroids to treat neuromuscular disorders
EP2167136B1,EP1495769B1,2008-02-27,LBR Medbiotech B.V.,Mannose-6-phosphate receptor mediated gene transfer into muscle cells
EP2167136B1,US20050054752A1,2005-03-10,O'brien John P.,Peptide-based diblock and triblock dispersants and diblock polymers
EP2167136B1,US7355018B2,2008-04-08,"Regeneron Pharmaceuticals, Inc.",Modified IGF1 polypeptides with increased stability and potency
EP2167136B1,US20050222009A1,2005-10-06,Itschak Lamensdorf,Dual phase - PNA conjugates for the delivery of PNA through the blood brain barrier
EP2167136B1,US20050191636A1,2005-09-01,"Biocept, Inc.","Detection of STRP, such as fragile X syndrome"
EP2167136B1,WO2005116204A1,2005-12-08,"Rnai Co., Ltd.",Polynucleotide causing rna interfere and method of regulating gene expression with the use of the same
EP2167136B1,HUE028632T2,2016-12-28,Univ Western Australia,Antisense oligonucleotides for inducing exon skipping and methods of use thereof
EP2167136B1,EP1618881A1,2006-01-25,Santhera Pharmaceuticals (Schweiz) GmbH,Use of non-glucocorticoid steroids for the treatment of muscular dystrophy
EP2167136B1,ITRM20040568A1,2005-02-18,Uni Degli Studi Di Roma Tor Vergata,"USE OF THE ""PHAGE DISPLAY"" TECHNIQUE FOR THE IDENTIFICATION OF PEPTIDES WITH CAPACITY OF STAMIN CELLS / PROGENITOR, PEPTIDES SO OBTAINED AND THEIR USES."
EP2167136B1,US20060148740A1,2006-07-06,Prosensa B.V.,Mannose-6-phosphate receptor mediated gene transfer into muscle cells
EP2167136B1,US20060257912A1,2006-11-16,"Medtronic, Inc.",Methods and sequences to suppress primate huntington gene expression
EP2167136B1,CN100393320C,2008-06-11,奥林格斯技术有限公司,Oligonucleotide medicine for treating myophagism
EP2167136B1,WO2007002904A2,2007-01-04,"Medtronic, Inc.",Methods and sequences to preferentially suppress expression of mutated huntingtin
EP2167136B1,US7906617B2,2011-03-15,E. I. Du Pont De Nemours And Company,Polyethylene binding peptides and methods of use
EP2167136B1,US20100248239A1,2010-09-30,Mayo Foundation For Medical Education And Research,Methods and materials for detecting fragile x mutations
EP2167136B1,US20110166081A1,2011-07-07,University Of Iowa Research Foundation,Alpha-dystroglycan as a Protein Therapeutic
EP2167520A2,FR2676058B1,1994-02-25,Hoechst Lab,"GLYCOSYLATED PRODUCTS, THEIR PREPARATION PROCESS AND THEIR USE IN THE TREATMENT OF CANCERS."
EP2167520A2,DE4236237A1,1994-04-28,Behringwerke Ag,"Prodrugs, their preparation and use as medicines"
EP2167520A2,EP0647450A1,1995-04-12,BEHRINGWERKE Aktiengesellschaft,Improved prodrugs for enzyme mediated activation
EP2171877A1,JP3702464B2,2005-10-05,ソニー株式会社,"Data conversion device, data conversion method, learning device, learning method, program, and recording medium"
EP2171877A1,KR101190875B1,2012-10-15,프랑스 뗄레콤,Dimensional vector and variable resolution quantization
EP2171877A1,US7362822B2,2008-04-22,Intel Corporation,Recursive reduction of channel state feedback
EP2171877A1,US7539253B2,2009-05-26,Intel Corporation,Interpolation in channel state feedback
EP2171877A1,CN1972138A,2007-05-30,美国日本电气实验室公司,Nonlinear precoding in code-division multiple access communication system
EP2171877A1,US7571094B2,2009-08-04,Texas Instruments Incorporated,"Circuits, processes, devices and systems for codebook search reduction in speech coders"
EP2171877A1,FR2893432B1,2008-01-04,Atmel Corp,VECTOR QUANTIFIER BASED ON SPACE DICHOTOMY WITH N DIMENSIONS
EP2173208A1,US5184410A,1993-02-09,Hamilton Paul R,Pivoting shoe construction
EP2173208A1,US5481814A,1996-01-09,Spencer; Robert A.,Snap-on hinged shoe
EP2173208A1,DE19611797A1,1997-10-02,Richter Monika Dr,Movable heel section for footwear
EP2173208A1,NL1020208C1,2003-09-23,Albert Adriaan Flinterman,"Shoe with hinged sole, has hinge with metal plate or strip protruding from one part of hinge into space in another hinge part"
EP2177849A1,US4981019A,1991-01-01,Hicks Carole L,Solar powered portable food container
EP2177849A1,EP0645593A1,1995-03-29,Fuji Electric Co. Ltd.,Electronic cooling type refrigerator
EP2177849A1,JP2000088424A,2000-03-31,Msc Technos:Kk,Refrigerator having electronic refrigerating device and absorption refrigerating device
EP2177849A1,US20020104318A1,2002-08-08,Ali Jaafar,Miniature thermoelectric cooler
EP2177849A1,KR20040051119A,2004-06-18,조민수,vacuum food reservior
EP2177849A1,US3889486A,1975-06-17,Pax Systems Inc,Refrigeration system for air cargo containers
EP2177849A1,US4586342A,1986-05-06,"Nissin Electric Co., Ltd.",Dehumidifying and cooling apparatus
EP2177849A1,JPH10111059A,1998-04-28,Fuji Electric Co Ltd,Electronic cooling type refrigerator
EP2177849A1,US6751963B2,2004-06-22,"The Coleman Company, Inc.",Portable insulated container with refrigeration
EP2177849A1,JP2004340404A,2004-12-02,Matsushita Electric Ind Co Ltd,Heat radiator for electronic refrigerator
EP2177849A1,JP4491613B2,2010-06-30,インバイロクーラー・リミテッド・ライアビリティ・カンパニー,Insulated transport container
EP2177849A1,US7278270B2,2007-10-09,"The Coleman Company, Inc.",Insulated container with thermoelectric unit
EP2177849A1,WO2006090995A2,2006-08-31,Daewoo Electronics Corporation,Storage container using a thermoelement
EP2177849A1,US7263855B2,2007-09-04,"Doubleday Acquisitions, Llc",Cargo container for transporting temperature sensitive items
EP2177849A1,WO2007018580A2,2007-02-15,"Eic Solutions, Inc.",Thermoelectrically air conditioned transit case
EP2177849A1,JP4566111B2,2010-10-20,三洋電機株式会社,Cold storage
EP2177849A1,AU2006236102A1,2007-05-31,Fcl Interstate Transport Services Pty Ltd,An improved freight container
EP2177849A1,US20090241554A1,2009-10-01,"Kitakyushu Foundation For The Advancement Of Industry, Science And Technology",Peltier device and temperature regulating container equipped with the peltier device
EP2177849A1,DE102006017012B4,2011-01-13,Airbus Operations Gmbh,Cooling system and freight container
EP2177849A1,GB2443657A,2008-05-14,4Energy Ltd,Thermoelectric refrigerating device
EP2177849A1,US8353167B2,2013-01-15,Ignite Innovations LLC,Solar-powered refrigerated container
EP2177849A1,US8316650B2,2012-11-27,GM Global Technology Operations LLC,System and method for heating and cooling a vehicle
EP2178817B1,JPS63270313A,1988-11-08,Mitsubishi Metal Corp,Composition for forming film and powder of metallic oxide of rare earth element
EP2178817B1,GB0119727D0,2001-10-03,Qinetiq Ltd,Photoluminescent compounds
EP2178817B1,US20060057071A1,2006-03-16,Wing-Tak Wong,Paramagnetic complexes with pendant crown compounds showing improved targeting-specificity as MRI contrast agents
EP2178817B1,KR100695744B1,2007-03-19,한국원자력연구소,"DTPAdiethylenetriamine pentaacetic acid derivatives and metal complexes thereof, radiation source and contrast agent including the metal complexes"
EP2178817B1,EP2017253A1,2009-01-21,UMC Utrecht Holding B.V.,A particle comprising an organic lanthanide metal complex
EP2179574B1,US6549625B1,2003-04-15,Nokia Corporation,Method and system for connecting a mobile terminal to a database
EP2179574B1,US6735430B1,2004-05-11,"Motorola, Inc.",Musical telephone with near field communication capabilities
EP2179574B1,GB2362070B,2004-06-16,Nokia Mobile Phones Ltd,Communication devices and method of communication
EP2179574B1,US7289102B2,2007-10-30,Microsoft Corporation,Method and apparatus using multiple sensors in a device with a display
EP2179574B1,JP2002251653A,2002-09-06,Nippon Conlux Co Ltd,Cashless automatic vending machine system
EP2179574B1,JP4113387B2,2008-07-09,シャープ株式会社,"Portable terminal device, information reading program, and recording medium recording the program"
EP2179574B1,JP4329388B2,2009-09-09,ソニー株式会社,"Data communication system, data communication apparatus, data communication method, and computer program"
EP2179574B1,JP4340860B2,2009-10-07,日本電気株式会社,Face matching system
EP2179574B1,US20050219223A1,2005-10-06,Kotzin Michael D,Method and apparatus for determining the context of a device
EP2179574B1,US7602744B2,2009-10-13,Nokia Corporation,Detection of a simultaneous occurrence of an event at a plurality of devices
EP2179574B1,JP4736398B2,2011-07-27,日本電気株式会社,"Authentication method between secret terminals, secret information delivery method, apparatus, system, and program"
EP2179574B1,JP5032127B2,2012-09-26,パナソニック株式会社,Wireless communication apparatus and communication control method
EP2179574B1,US20070174243A1,2007-07-26,Fritz Charles W,Mobile social search using physical identifiers
EP2182328A1,EP0805609A2,1997-11-05,Hewlett-Packard Company,Method and apparatus for tracking identity-code changes in a mobile communications system
EP2182328A1,WO2005091661A1,2005-09-29,Telefonaktiebolaget Lm Ericsson (Publ),Method of and system for selecting a plmn for network sharing
EP2182328A1,WO2008051716A1,2008-05-02,"Sonus Networks, Inc.",Separating signaling portions in a unified wireline/wireless communication network
EP2182328A1,US5546444A,1996-08-13,Bellsouth Corporation,Methods and apparatus for communicating data via a cellular network control channel
EP2182328A1,US5915225A,1999-06-22,Ericsson Inc.,Remotely retrieving SIM stored data over a connection-less communications link
EP2182328A1,US6437692B1,2002-08-20,"Statsignal Systems, Inc.",System and method for monitoring and controlling remote devices
EP2182328A1,KR100594101B1,2006-06-30,삼성전자주식회사,System and method for supporting multimedia broadcast/multicast service in non tracking area
EP2182328A1,CN1771743A,2006-05-10,弗拉里奥恩技术公司,Paging methods and apparatus
EP2182328A1,US7787855B2,2010-08-31,"Motorola, Inc.",Establishing emergency sessions in packet data networks for wireless devices having invalid subscriber identities
EP2182328A1,US8665082B2,2014-03-04,Arthroscopic Surgery Associates Corporation,Method and apparatus for monitoring conditions
EP2182328A1,JP4585002B2,2010-11-24,テレフオンアクチーボラゲット  エル  エム  エリクソン（パブル）,High-speed network connection mechanism
EP2182328A1,US7558234B2,2009-07-07,"Tektronix, Inc.",System and method for correlation of mobile subscriber activity across multiple interfaces in a GPRS network
EP2182328A1,US8107954B2,2012-01-31,Research In Motion Limited,System and method for wireless network selection by multi-mode devices
EP2182328A1,DE602007010837D1,2011-01-05,Ericsson Telefon Ab L M,NETWORK NODES AND METHODS OF SUPPORTING COMMUNICATION
EP2182328A1,US8649799B2,2014-02-11,Telefonaktiebolaget L M Ericsson (Publ),Unlicensed mobile access (UMA) terminal location in a communications network
EP2182328A1,EP2129095B1,2012-07-11,Koninklijke KPN N.V.,M2M communication using a plurality of SIM-less communication modules
EP2188722A1,CA2152827A1,1994-07-21,Kenneth John Jones,Vapour emission devices for refuse containers
EP2188722A1,US6874105B2,2005-03-29,International Business Machines Corporation,Operation graph based event monitoring system
EP2188722A1,US6519766B1,2003-02-11,Isogon Corporation,Computer program profiler
EP2188722A1,US6862696B1,2005-03-01,Cigital,System and method for software certification
EP2188722A1,US6735758B1,2004-05-11,International Business Machines Corporation,Method and system for SMP profiling using synchronized or nonsynchronized metric variables with support across multiple systems
EP2188722A1,CA2350735A1,2002-09-14,Ibm Canada Limited-Ibm Canada Limitee,A method for providing open access to application profiling data
EP2188722A1,EP1331565B1,2018-09-12,Texas Instruments France,Application execution profiling in conjunction with a virtual machine
EP2188722A1,US7581224B2,2009-08-25,"Hewlett-Packard Development Company, L.P.",Systems and methods for monitoring resource utilization and application performance
EP2188722A1,US9380269B2,2016-06-28,Time Warner Cable Enterprises Llc,Scheduling trigger apparatus and method
EP2188722A1,US20050125784A1,2005-06-09,Rhode Island Board Of Governors For Higher Education,Hardware environment for low-overhead profiling
EP2188722A1,US7735073B1,2010-06-08,Oracle International Corporation,Method and apparatus for data object profiling
EP2188722A1,US8065665B1,2011-11-22,"Oracle America, Inc.",Method and apparatus for correlating profile data
EP2188722A1,US7827543B1,2010-11-02,"Oracle America, Inc.",Method and apparatus for profiling data addresses
EP2188722A1,US7451064B2,2008-11-11,"Hewlett-Packard Development Company, L.P.","System and method for logging hardware usage data, and uses for such logged hardware usage data"
EP2188722A1,US7788644B2,2010-08-31,Sap Ag,Method and system for monitoring performance on a mobile device
EP2188722A1,US7184939B1,2007-02-27,"Novell, Inc.",System and method of implementing user action monitoring to automatically populate object launchers
EP2188722A1,US8230059B1,2012-07-24,"Hewlett-Packard Development Company, L.P.",Method of monitoring resource usage in computing environment
EP2188722A1,US8166462B2,2012-04-24,"Oracle America, Inc.",Method and apparatus for sorting and displaying costs in a data space profiler
EP2188722A1,US8640114B2,2014-01-28,"Oracle America, Inc.",Method and apparatus for specification and application of a user-specified filter in a data space profiler
EP2188722A1,US8176475B2,2012-05-08,"Oracle America, Inc.",Method and apparatus for identifying instructions associated with execution events in a data space profiler
EP2188722A1,US8813055B2,2014-08-19,"Oracle America, Inc.",Method and apparatus for associating user-specified data with events in a data space profiler
EP2188722A1,US8032875B2,2011-10-04,"Oracle America, Inc.",Method and apparatus for computing user-specified cost metrics in a data space profiler
EP2188722A1,GB2448952B,2012-02-22,Daniel Woolman,Sanitizing device
EP2188722A1,US8850403B2,2014-09-30,Sap Ag,Profiling data snapshots for software profilers
EP2190245A1,EP0852448A1,1998-07-08,Nokia Mobile Phones Ltd.,User terminal for mobile communications
EP2190245A1,WO1998058512A1,1998-12-23,"Siemens Information And Communication Networks, Inc.",Mobile station having a cost-efficient call management method and system
EP2190245A1,WO2001093614A2,2001-12-06,Ericsson Inc,Wireless communications terminals and methods including multiple entry phonebook for multiple transceivers
EP2190245A1,US20020059434A1,2002-05-16,Jeyhan Karaoguz,Multi-mode controller
EP2190245A1,WO2004008793A1,2004-01-22,Qualcomm Incorporated,Interface selection in a wireless communication network
EP2190245A1,WO2004031488A2,2004-04-15,Koninklijke Philips Electronics N.V.,Smart connection management of portable devices
EP2190245A1,EP1526682A2,2005-04-27,Microsoft Corporation,Network and interface selection on a computing device
