publication_number,patent_citation,publication_date,assignee,title
EP2096884A1,US7003569B2,2006-02-21,Cypress Semiconductor Corp.,Follow-up notification of availability of requested application service and bandwidth between client(s) and server(s) over any network
EP2096884A1,US20020180614A1,2002-12-05,Gonzalez Javier Janez,Internet-ready communication modules
EP2096884A1,US6819926B2,2004-11-16,Telefonaktiebolaget Lm Ericsson (Publ),System and method for providing protection from an overload condition within the home location register
EP2096884A1,US6768905B2,2004-07-27,"M/A-Com Private Radio Systems, Inc.",Method and processor for determining loading of a telecommunications system and applications of the system-loading determination
EP2096884A1,WO2003028310A1,2003-04-03,Research In Motion Limited,Mobile device and method for handling gprs attach rejection
EP2096884A1,EP1446918B1,2007-10-03,"Matsushita Electric Industrial Co., Ltd.",Methods for ensuring medium access in a wireless network
EP2096884A1,US7301893B2,2007-11-27,Texas Instruments Incorporated,Linear space-time block code with block STTD structure
EP2096884A1,US9374451B2,2016-06-21,Nokia Technologies Oy,System and method for multimodal short-cuts to digital services
EP2096884A1,US7224744B2,2007-05-29,Regents Of The University Of Minnesota,Space-time multipath coding schemes for wireless communication systems
EP2096884A1,JP2004072367A,2004-03-04,Nippon Telegr & Teleph Corp <Ntt>,Method of authenticating wireless terminal device
EP2096884A1,US7185067B1,2007-02-27,"Cisco Technology, Inc.",Load balancing network access requests
EP2096884A1,JP2004120136A,2004-04-15,Fujitsu Ltd,Preferencial connection method in congestion time
EP2096884A1,US20080132207A1,2008-06-05,Gallagher Michael D,Service access control interface for an unlicensed wireless communication system
EP2096884A1,US7152102B2,2006-12-19,Microsoft Corporation,On-line wizard entry point management computer system and method
EP2096884A1,KR100594101B1,2006-06-30,삼성전자주식회사,System and method for supporting multimedia broadcast/multicast service in non tracking area
EP2096884A1,US20040162070A1,2004-08-19,Elliott Baral,Method and apparatus for monitoring and filtering abnormal behavior of mobile stations in a wireless network
EP2096884A1,US6999759B2,2006-02-14,"Motorola, Inc.",Method and apparatus for providing deferrable data services in a cellular communication system
EP2096884A1,KR100590863B1,2006-06-19,삼성전자주식회사,Apparatus and method for processing a terminal authentication and a call in a private wireless high-speed data system
EP2096884A1,KR100959719B1,2010-05-25,엘지전자 주식회사,Radio resource management method in mobile communication system
EP2096884A1,GB2401745B,2006-02-15,Desktop Guardian Ltd,Method of controlling computer access
EP2096884A1,JP5054377B2,2012-10-24,メッシュネットワークス  インコーポレイテッド,Systems and methods for achieving fairness and service differentiation in ad hoc networks
EP2096884A1,US7228134B2,2007-06-05,Lucent Technologies Inc.,Method of minimizing reverse channel interference caused by an abnormally high number of access attempts in a wireless communications system
EP2096884A1,FI20030943A,2004-12-26,Nokia Corp,Procedure for configuring parameters for a machine-to-machine module and a machine-to-machine module
EP2096884A1,"JP5043431B2


                      †",2012-10-10,ディズニー  エンタープライゼス  インコーポレイテッド,Parental control of mobile phones
EP2096884A1,JP4367090B2,2009-11-18,日本電気株式会社,Observation result communication terminal and information collection system
EP2096884A1,SE0303031D0,2003-11-12,Ericsson Telefon Ab L M,Inter-Frequency and inter-rat handover measurements
EP2096884A1,US7236795B2,2007-06-26,Lucent Technologies Inc.,Controlling processor load in a wireless telecommunications network node
EP2096884A1,US7328027B1,2008-02-05,Sprint Spectrum L.P.,Method for vocoder selection based on loads in coverage areas of a wireless wide area network
EP2096884A1,CN100334853C,2007-08-29,中兴通讯股份有限公司,Method for realizing radio local network negantive load uniform using radio network information
EP2096884A1,US8380528B2,2013-02-19,"At&T Intellectual Property I, L. P.",Controlling service provided by a packet switched network based on bids from consumer equipment
EP2096884A1,JP4399331B2,2010-01-13,久美子 田中,Call control method
EP2096884A1,CN100505658C,2009-06-24,北京握奇数据系统有限公司,Method for realizing wireless LAN accessing
EP2096884A1,US20060208852A1,2006-09-21,Eduard Wenzlik,Method for managing user rights for a code-protected object
EP2096884A1,EP1847144B1,2014-07-09,Telefonaktiebolaget LM Ericsson (publ),Transmission in a shared medium having different access modes
EP2096884A1,JP4567472B2,2010-10-20,株式会社エヌ・ティ・ティ・ドコモ,Data communication restriction method and data communication restriction control device for flat-rate users
EP2096884A1,US8112083B1,2012-02-07,Sprint Spectrum L.P.,Method and system for dynamic adjustment of radio frequency registration period based on load conditions
EP2096884A1,US7697896B2,2010-04-13,Sony Computer Entertainment Inc.,Communication apparatus preventing communication interference
EP2096884A1,KR100991657B1,2010-11-04,퀄컴 인코포레이티드,Method and apparatus for throttling access to a shared resource
EP2096884A1,US20060268838A1,2006-11-30,Telefonaktiebolaget Lm Ericsson (Publ),Authentication of an application layer media flow request for radio resources
EP2096884A1,KR101175813B1,2012-08-24,삼성전자주식회사,System and method of congestion control in wireless mesh networks
EP2096884A1,WO2007002118A2,2007-01-04,"Airsage, Inc.",Method and system for using cellular data for transportation planning and engineering
EP2096884A1,US7236791B2,2007-06-26,Lucent Technologies Inc.,Radio channel allocation for national security and emergency preparedness calls
EP2096884A1,DE102005037874B4,2008-07-24,Nokia Siemens Networks Gmbh & Co.Kg,Method and arrangement for controlling and charging peer-to-peer services in an IP-based communication network
EP2096884A1,EP1770918A1,2007-04-04,Evolium Sas,Data flow control on the interfaces of a radio access network
EP2096884A1,JP5080481B2,2012-11-21,テレフオンアクチーボラゲット  エル  エム  エリクソン（パブル）,Selection of radio network control station for IP-connected radio base station
EP2096884A1,FR2891931B1,2008-02-22,Wavecom Sa,"RADIO COMMUNICATION DEVICE COMPRISING AT LEAST ONE RADIOCOMMUNICATION MODULE AND A SIM CARD, RADIO COMMUNICATION MODULE AND SIM CARD THEREOF"
EP2096884A1,JP4948104B2,2012-06-06,エヌ・ティ・ティ・ソフトウェア株式会社,Access control device and wireless IP telephone system
EP2096884A1,US8180363B2,2012-05-15,Sony Computer Entertainment Inc.,Communication apparatus preventing communication interference
EP2096884A1,US7519354B2,2009-04-14,At&T Mobility Ii Llc,Dynamic authentication configuration in a network
EP2096884A1,US20070157292A1,2007-07-05,Netiq Corporation,"System, method, and computer-readable medium for just in time access through dynamic group memberships"
EP2096884A1,US8831607B2,2014-09-09,Qualcomm Incorporated,Reverse link other sector communication
EP2096884A1,US7693128B2,2010-04-06,"Freescale Semiconductor, Inc.",Managing packets for transmission in a communication system
EP2096884A1,CN1859499A,2006-11-08,华为技术有限公司,Method for transfering audible ringing tone mark to network side
EP2096884A1,US7840214B2,2010-11-23,Alcatel-Lucent Usa Inc.,Method of providing access information to an access terminal
EP2096884A1,US20070268908A1,2007-11-22,"T-Mobile Usa, Inc.",System and method for authorizing access to a UMA network based on access point identifier
EP2096884A1,EP1858210A1,2007-11-21,Whitestein Information Technology Group AG,Method and system for adaptive communication service access
EP2096884A1,JP4779827B2,2011-09-28,日本電気株式会社,"Network control system, wireless communication apparatus, and network control method"
EP2096884A1,US8817606B2,2014-08-26,Alcatel Lucent,Managing overload of an access medium for a communication system
EP2096884A1,US8064401B2,2011-11-22,Qualcomm Incorporated,Expedited handoff
EP2096884A1,US8495181B2,2013-07-23,"Citrix Systems, Inc",Systems and methods for application based interception SSI/VPN traffic
EP2096884A1,US8630885B2,2014-01-14,"Skadool, Inc.",System and method for providing temporary and limited grants of calendar access
EP2096884A1,US20080066125A1,2008-03-13,"Sbc Knowledge Ventures, L.P.",Method and system for content distribution
EP2096884A1,KR101210334B1,2012-12-10,서강대학교산학협력단,Apparatus and method for routing table management in multi-hop system
EP2096884A1,US20080075032A1,2008-03-27,Krishna Balachandran,Method of resource allocation in a wireless communication system
EP2096884A1,JP4805080B2,2011-11-02,株式会社エヌ・ティ・ティ・ドコモ,"Communication control method, radio base station, and radio control station"
EP2096884A1,EP2087610B1,2015-09-09,QUALCOMM Incorporated,"Unified design and centralized scheduling for dynamic simo, su-mimo and mu-mimo operation for rl transmissions"
EP2096884A1,GB0623842D0,2007-01-10,British Telecomm,Secure access
EP2096884A1,EP1928190A1,2008-06-04,Nokia Siemens Networks Gmbh & Co. Kg,Method for controlling transmissions between neighbouring nodes in a radio communications system and access node thereof
EP2096884A1,US8032547B2,2011-10-04,Research In Motion Limited,Methods and apparatus for use in controlling a scan rate for scanning operations in a mobile communication device
EP2096884A1,US7774008B2,2010-08-10,Cellco Partnership,MDN-less SMS messaging (network solution) for wireless M2M application
EP2096884A1,US8189460B2,2012-05-29,"Cisco Technology, Inc.",Method and system for providing congestion management within a virtual talk group
EP2096884A1,US20080162707A1,2008-07-03,Microsoft Corporation,Time Based Permissioning
EP2096884A1,AR065087A1,2009-05-13,Interdigital Tech Corp,DESTRICTION OF CELL ACCESS AND OPTIMIZATION TO THE WRTU ACCESS CLASS IN THE LTE SYSTEM INFORMATION
EP2096884A1,GB2448003A,2008-10-01,Siemens Ag,Controlling information requests in a communications network to prevent congestion
EP2096884A1,CN100490554C,2009-05-20,上海华为技术有限公司,Network optimization method and its system
EP2096884A1,US8064882B2,2011-11-22,"Cisco Technology, Inc.",Blacklisting of unlicensed mobile access (UMA) users via AAA policy database
EP2096884A1,CN101080032A,2007-11-28,华为技术有限公司,A high-speed downlink packet access capacity estimation method and device
EP2096884A1,WO2009002236A1,2008-12-31,Telefonaktiebolaget Lm Ericsson (Publ),A method and apparatus for enabling connectivity in a communication network
EP2096884A1,CN101106417B,2011-05-11,北京航空航天大学,A satellite call access control method
EP2096884A1,US9572089B2,2017-02-14,"Interdigital Patent Holdings, Inc.",Method and apparatus for supporting home Node B services
EP2096884A1,US9055511B2,2015-06-09,Qualcomm Incorporated,Provisioning communication nodes
EP2096884A1,US8380169B2,2013-02-19,Qualcomm Incorporated,System and method for enabling transaction of femto cell information from a host terminal device to a guest terminal device
EP2096884A1,US8832286B2,2014-09-09,International Business Machines Corporation,Method and system for controlling client access to a server application
EP2096884A1,US20090141661A1,2009-06-04,Nokia Siemens Networks Oy,Residual traffic state for wireless networks
EP2096884A1,US8839386B2,2014-09-16,"At&T Intellectual Property I, L.P.",Method and apparatus for providing authentication
EP2096884A1,US8028327B1,2011-09-27,Sprint Spectrum L.P.,Method and system for a low-cost-internet-base station (LCIB) granting a client device temporary access
EP2096884A1,US20090191857A1,2009-07-30,Nokia Siemens Networks Oy,Universal subscriber identity module provisioning for machine-to-machine communications
EP2096884A1,EP2096884A1,2009-09-02,Koninklijke KPN N.V.,Telecommunications network and method for time-based network access
EP2098596A1,GB709558A,1954-05-26,Manton Gaulin Mfg Company Inc,Process of modifying the starch content of amylaceous material
EP2098596A1,JPS55155777A,1980-12-04,Baiorisaac Center:Kk,Treatment of anaerobic digestion of organic waste
EP2098596A1,WO1981000576A1,1981-03-05,B Haegerdal,Immobilized enzyme(s)and microorganism(s)and their production
EP2098596A1,US4327184A,1982-04-27,University Of Utah,Inert-gas stripping and distillation apparatus
EP2098596A1,US5693296A,1997-12-02,The Texas A&M University System,Calcium hydroxide pretreatment of biomass
EP2098596A1,WO2004113549A1,2004-12-29,Carl Ludwig Wilkening,Improved methods for producing ethanol and methane from biomass
EP2098596A1,US20070141691A1,2007-06-21,"Stanley Consultants, Inc.",Process for producing ethanol and for energy recovery
EP2098596A1,WO2007104418A1,2007-09-20,Michael Strecker,Method and device for obtaining biogas
EP2098596A1,WO2006017712A2,2006-02-16,The Board Of Trustees Of The University Of Illinois,Corn oil and dextrose extraction apparatus and method
EP2098596A1,DE102005047719A1,2007-04-12,Biogas Anlagen Leipzig Gmbh,Method for using biomass in a biogas process
EP2098596A1,DE102007017184A1,2008-10-16,Evonik Degussa Gmbh,Process for integrated utilization of the energy and substance contents of hydrolysates
EP2103073A1,US6061738A,2000-05-09,"D&I Systems, Inc.",Method and system for accessing information on a network using message aliasing functions having shadow callback functions
EP2103073A1,US7313822B2,2007-12-25,Protegrity Corporation,Application-layer security method and system
EP2103073A1,JP4487490B2,2010-06-23,ソニー株式会社,"Information processing apparatus, access control processing method, information processing method, and computer program"
EP2103073A1,KR20050118680A,2005-12-19,액세스텔 아이엔씨.,Wireless gateway
EP2103073A1,JP3974554B2,2007-09-12,日本電信電話株式会社,gateway
EP2103073A1,US20050249214A1,2005-11-10,Tao Peng,System and process for managing network traffic
EP2103073A1,US8074277B2,2011-12-06,"Check Point Software Technologies, Inc.",System and methodology for intrusion detection and prevention
EP2103073A1,JP4602158B2,2010-12-22,三菱電機株式会社,Server equipment protection system
EP2103073A1,KR100695204B1,2007-03-14,에스케이 텔레콤주식회사,Method and System for Status of Application Storing by Using Mobile Communication Terminal
EP2103310A8,WO1993009807A1,1993-05-27,The Scripps Research Institute,Methods of inhibiting thrombosis via elevation of circulating endogenous activated protein c levels
EP2103310A8,US5912019A,1999-06-15,Musc Foundation For Research Development,Compounds for reducing ischemia/reperfusion injury
EP2103310A8,EP1328622A2,2003-07-23,Maxygen Aps,Protein c or activated protein c-like molecules
EP2103310A8,EP1651252B1,2014-11-26,The Scripps Research Institute,Activated protein c variants with normal cytoprotective activity but reduced anticoagulant activity
EP2103310A8,US20070299013A1,2007-12-27,Michael Kalafatis,Exosite-Directed Thrombin Inhibitors
EP2103310A8,WO2006049580A1,2006-05-11,National University Of Singapore,Anticoagulant peptides
EP2103310A8,US20100322921A1,2010-12-23,Rekha Bansal,METHOD OF INHIBITING COAGULATION ACTIVATION WITH HUMAN ANTI-FACTOR Va ANTIBODIES AND USE THEREOF
EP2104318A1,WO2001095603A1,2001-12-13,Koninklijke Kpn N.V.,Communication system
EP2104318A1,WO2002008132A1,2002-01-31,Heraeus Tenevo Ag,Method for producing a blank for optical fibres and blank and optical fibres
EP2104318A1,WO2002080132A1,2002-10-10,Koninklijke Philips Electronics N.V.,Notification service on transportation network
EP2104318A1,US20040233897A1,2004-11-25,Keisuke Yamaguchi,System and method for controlling communication using device ID
EP2104318A1,WO2006008223A1,2006-01-26,Swisscom Mobile Ag,"Method, by which a terminal can retrieve information associated to an epc-code from an epc network"
EP2104318A1,EP1739898A1,2007-01-03,NTT DoCoMo INC.,Data communication apparatus and data communication method
EP2107182A1,FR2199569A2,1974-04-12,Pregypan Sa,
EP2107182A1,DE2408420A1,1975-08-28,Hans Zimmermann,"Flexible framed panel-cladded partition wall - sprung between uprights and ceiling bar, with panel allowing maximum oscillation amplitudes"
EP2107182A1,US4069639A,1978-01-24,Lindner Robert L,Wall assembly
EP2107182A1,WO1997014855A1,1997-04-24,Pehrson Claes Goeran,A mounting method for building construction
EP2107182A1,WO2008026982A1,2008-03-06,Patrick Johansson,Method and means to assemble a building board on a support
EP2107182A1,DE8908136U1,1989-08-10,"Schueco International Gmbh & Co, 4800 Bielefeld, De",
EP2107182A1,DE4004698C1,1991-04-18,"Saelzer Sicherheitstechnik Gmbh, 3550 Marburg, De",Building window-frame construction - includes glass-strip weather bar fitting on frame bars or glass wall
EP2107182A1,DE19736157C1,1999-02-04,Maik Bieling,Sealed frame for door or window of building
EP2109375A1,US3444957A,1969-05-20,Rose Mfg Co,Shock absorber for safety belt
EP2109375A1,US4100996A,1978-07-18,Sharp Jonathan E,Shock absorber for a safety belt lanyard
EP2109375A1,US4272850A,1981-06-16,W. H. Brine Company,Body protective pads
EP2109375A1,US4384372A,1983-05-24,Rector Michael H,Back support belt attachment
EP2109375A1,US4401246A,1983-08-30,"Torel, Inc.",Adjustable carrying strap
EP2109375A1,US4795399A,1989-01-03,Davis Walter W,Brassiere shoulder strap bearing pad
EP2109375A1,US4887318A,1989-12-19,Weinreb Robert L,Shoulder pad
EP2109375A1,US5155869A,1992-10-20,Ralli Mirianne M,Contoured shoulder pad with closeable pocket for valuables
EP2109375A1,US5174410A,1992-12-29,"Db Industries, Inc.",Shock absorber safety system for workers and method of making same
EP2109375A1,US5319806A,1994-06-14,Jeffery Allen Hermann,Shoulder guard harness
EP2109375A1,US5259833A,1993-11-09,Barnett Larry W,Back bending motion limiting apparatus
EP2109375A1,JP2864199B2,1999-03-03,陽一 遠藤,Protector
EP2109375A1,US5960480A,1999-10-05,Otis Elevator Company,Fall protection safety suit
EP2109375A1,US5806733A,1998-09-15,"Nepsco, Inc.",Shoulder carrying strap
EP2109375A1,US6101637A,2000-08-15,Lessard; Wilfred E.,Shoulder protector
EP2109375A1,US6202214B1,2001-03-20,Edward A. Light,Padded shoulder protection device
EP2109375A1,US6267280B1,2001-07-31,Howard Silagy,Strap cushioning pad and lacing method of attachment
EP2109375A1,NL1016273C1,2002-03-27,Spreeuwenberg Steigerbouw B V,"The method is for carrying object on shoulder where object is placed on auxiliary device formed by under layer of sprung material and upper layer of hard material, device being connected to clothing by cord or similar"
EP2109375A1,US6684406B2,2004-02-03,Sandra S. Fowler,Protective hand guard
EP2109375A1,GB0130834D0,2002-02-06,Design Blue Ltd,Energy absorbing material
EP2109375A1,JP4012018B2,2007-11-21,委加 池本,Shoulder rest
EP2109375A1,US6971476B2,2005-12-06,"D B Industries, Inc.",Safety harness
EP2109375A1,US20050229286A1,2005-10-20,Tseng Yung-Lung,Golf glove and replaceable saving pads
EP2109375A1,US20060054387A1,2006-03-16,Paul-Emile Fortin,Saftey harness
EP2109375A1,US20060210789A1,2006-09-21,"Shiun Jiug Industrial Co., Ltd.",Skid-proof and ventilated cushion
EP2109375A1,US20070143908A1,2007-06-28,Ricardo Phillips,Shoulder protector
EP2109375A1,USD649291S1,2011-11-22,Cappuccio Louis W,Protective shoulder pad
EP2111720A1,US6505046B1,2003-01-07,Nortel Networks Limited,Method and apparatus for distributing location-based messages in a wireless communication network
EP2111720A1,US6647257B2,2003-11-11,"Leap Wireless International, Inc.",System and method for providing targeted messages based on wireless mobile location
EP2111720A1,US6470181B1,2002-10-22,Nortel Networks Limited,Method and apparatus for simultaneous text and audio for sponsored calls
EP2111720A1,GB2356321A,2001-05-16,Hugh Symons Group Plc,Technique for distributing information within a wireless network based on location information
EP2111720A1,WO2001086918A2,2001-11-15,Qwest Communications International Inc.,Location based messaging method and system
EP2111720A1,JP2001333455A,2001-11-30,Aisin Aw Co Ltd,"Mobile body advertisement information distribution method, mobile body advertisement information distribution system, mobile body advertisement information registration system, mobile body advertisement information charging system, mobile communication device and recording medium"
EP2111720A1,US6542748B2,2003-04-01,Telcontar,Method and system for automatically initiating a telecommunications connection based on distance
EP2111720A1,US6647269B2,2003-11-11,Telcontar,Method and system for analyzing advertisements delivered to a mobile unit
EP2111720A1,US20020049644A1,2002-04-25,Kargman James B.,Method for simplified one-touch ordering of goods and services from a wired or wireless phone or terminal
EP2111720A1,AT265126T,2004-05-15,Cit Alcatel,METHOD AND DEVICE FOR TRANSMITTING AN INFORMATION MESSAGE WITH ADAPTED CONTENT TO A USER OR A GROUP OF USERS OF A COMMUNICATION TERMINAL
EP2111720A1,US6377793B1,2002-04-23,Xybernaut Corporation,System and method of accessing and recording messages at coordinate way points
EP2111720A1,US6898517B1,2005-05-24,Trimble Navigation Limited,Vehicle-based dynamic advertising
EP2111720A1,GB0128220D0,2002-01-16,Koninkl Philips Electronics Nv,Location based delivery of service data
EP2111720A1,US7155405B2,2006-12-26,"Symbol Technologies, Inc.",System for communicating product and service related information to a user based on direction of movement
EP2112830A1,US20060053450A1,2006-03-09,Nokia Corporation,Mobile television electronic service guide delivery system
EP2112830A1,WO2006072825A1,2006-07-13,Nortel Networks Limited,Systems and methods for distributing content in wireless networks
EP2112830A1,CN1859561B,2010-05-12,华为技术有限公司,Stream media ordered telecast system and method
EP2113300A1,WO2004012133A2,2004-02-05,"Arryx, Inc.",System and method of sorting materials using holographic laser steering
EP2113300A1,EP1481723A1,2004-12-01,"Fuji Photo Film Co., Ltd.",Microdevice
EP2113300A1,WO2006078759A2,2006-07-27,New York University,Modulated optical tweezers
EP2123903A1,US3353787A,1967-11-21,Marcel S Semo,Useful power from ocean waves
EP2123903A1,US4145882A,1979-03-27,Ivar Thorsheim,Wave power generator
EP2123903A1,WO2000028151A1,2000-05-18,Paolo Boccotti,Caisson for absorbing wave energy
EP2123903A1,US20030184096A1,2003-10-02,Edwin Newman,Converting ocean energy into electrical energy using bourdon tubes and cartesian divers
EP2126226A1,US2134989A,1938-11-01,John B Templeton,Pile-driving attachment for booms
EP2126226A1,FR1458698A,1966-03-04,Raymond Int Inc,Transportable derricks and lifting devices
EP2126226A1,DE2201134C2,1985-05-02,Heinz 3320 Salzgitter Manten,Ramming and pulling device
EP2126226A1,US3768575A,1973-10-30,Foundation Equipment Corp,Joint construction for sectional lead
EP2126226A1,US3827508A,1974-08-06,Foundation Equipment Corp,Mechanical safety pile monkey
EP2126226A1,GB2060742B,1983-05-25,Sanwa Kizai Co Ltd,Driving sheet piles
EP2126226A1,JPH0211692B2,1990-03-15,Nippon Sharyo Seizo Kk,
EP2126226A1,US5216867A,1993-06-08,"Sundowner Offshore Services, Inc.",Well mast structure
EP2126226A1,EP0902128A3,1999-04-28,Van Splunder Funderingstechniek B.V.,Method for installing a foundation for a traffic course as well as device
EP2126226A1,GB0001323D0,2000-03-08,Sol Comp Du,Rotary displacement piling equipment
EP2133808A1,WO1993003450A1,1993-02-18,North Carolina State University,Method and apparatus for measuring blood lipoprotein levels by nmr spectroscopy
EP2135954A1,WO2000052189A1,2000-09-08,Technische Universiteit Delft,Method for the production of polyhydroxyalkanoate
EP2146723A1,AU2001253054A1,2001-10-08,The J. David Gladstone Institutes,Methods of treating cognitive decline disease conditions with androgens
EP2146723A1,CA2461280A1,2003-04-10,"Nuvelo, Inc.",Novel nucleic acids and polypeptides
EP2146723A1,US20040043410A1,2004-03-04,Carnazza James A.,Methods for testing for and inhibiting the development of Huntington's disease
EP2146723A1,EP1865955A4,2009-04-15,Merck & Co Inc,Method of treating men with testosterone supplement and 5alpha-reductase inhibitor
EP2149137A1,JPH11327492A,1999-11-26,Mitsubishi Electric Corp,Plane sequential color image display device and plane sequential color image display method
EP2149137A1,TWI240241B,2005-09-21,Koninkl Philips Electronics Nv,Assembly of a display device and an illumination system
EP2149137A1,US6888529B2,2005-05-03,Koninklijke Philips Electronics N.V.,Control and drive circuit arrangement for illumination performance enhancement with LED light sources
EP2149137A1,JP3840940B2,2006-11-01,株式会社日立製作所,Image display device
EP2149137A1,JP2003295154A,2003-10-15,Fuji Photo Film Co Ltd,Method of adjusting monochrome lcd color and medical image display device
EP2149137A1,US7320531B2,2008-01-22,"Philips Lumileds Lighting Company, Llc",Multi-colored LED array with improved brightness profile and color uniformity
EP2149137A1,US7009343B2,2006-03-07,Kevin Len Li Lim,System and method for producing white light using LEDs
EP2149137A1,JP2007122018A,2007-05-17,Toshiba Matsushita Display Technology Co Ltd,Liquid crystal display device
EP2164224A1,0,0,0,0
EP2167136B1,US5034506A,1991-07-23,Anti-Gene Development Group,Uncharged morpholino-based polymers having achiral intersubunit linkages
EP2167136B1,US5541308A,1996-07-30,Gen-Probe Incorporated,Nucleic acid probes for detection and/or quantitation of non-viral organisms
EP2167136B1,DE3834636C2,1992-02-20,"Max-Planck-Gesellschaft Zur Foerderung Der Wissenschaften Ev, 3400 Goettingen, De",
