publication_number,patent_citation,publication_date,assignee,title
EP3319457A1,0,0,0,0
EP3188375A2,0,0,0,None
EP3188391B1,0,0,0,None
EP3280786A1,0,0,0,0
EP3347857A1,0,0,0,0
EP3912998A2,0,0,0,"""GenBank"", Database accession no. XM_005571542"
EP3912998A2,0,0,0,"""NCBI"", Database accession no. NM_010195.2"
EP3912998A2,0,0,0,"CARMON, K.S. ET AL., PROC NATL ACAD SCI U S A, vol. 108, 2011, pages 11452 - 11457"
EP3912998A2,0,0,0,"CARTRON, BLOOD, vol. 99, no. 3, 2002, pages 754 - 758"
EP3912998A2,0,0,0,"DAVIDSON, E.DORANZ, B.J.: ""A high-throughput shotgun mutagenesis approach to mapping B-cell antibody epitope"", IMMUNOLOGY, vol. 143, 2014, pages 13 - 20, XP055788833, DOI: 10.1111/imm.12323"
EP3912998A2,0,0,0,"DE LAU WBARKER N ET AL.: ""Lgr5 homologues associate with Wnt receptors and mediate R-spondin signalling"", NATURE, vol. 476, no. 7360, 4 July 2011 (2011-07-04), pages 293 - 7"
EP3912998A2,0,0,0,"DE LAU, W. ET AL., GENES DEV, vol. 28, 2014, pages 305 - 316"
EP3912998A2,0,0,0,"DE LAU, W. ET AL., NATURE, vol. 476, 2011, pages 293 - 297"
EP3912998A2,0,0,0,"DI ET AL., PLOSONE, 2014"
EP3912998A2,0,0,0,"GULLI, L.F. ET AL.: ""Epidermal growth factor-induced apoptosis in A431 cells can be reversed by reducing the tyrosine kinase activity"", CELL GROWTH DIFFER, vol. 7, no. 2, 1996, pages 173 - 178"
EP3912998A2,0,0,0,"GUNASEKARAN, JBC, vol. 285, 2010, pages 19637 - 19646"
EP3912998A2,0,0,0,"HAARD ET AL., J BIOL CHEM., vol. 274, no. 26, 25 June 1999 (1999-06-25), pages 18218 - 30"
EP3912998A2,0,0,0,"HENNING VON HORSTEN, GLYCOBIOLOGY, vol. 20, no. 12, 2010, pages 1607 - 1618"
EP3912998A2,0,0,0,"J STRUCT BIOL, vol. 191, no. 2, August 2015 (2015-08-01), pages 149 - 55"
EP3912998A2,0,0,0,"J.C. ALMAGROLJ. FRANSSON, FRONTIERS IN BIOSCIENCE, vol. 13, 2008, pages 1619 - 1633"
EP3912998A2,0,0,0,"JUNTTILA, T. T., K. ET AL., CANCER RESEARCH, vol. 70, 2010, pages 4481 - 4489"
EP3912998A2,0,0,0,"LI SSCHMITZ KR ET AL.: ""Structural basis for inhibition of the epidermal growth factor receptor by cetuximab"", CANCER CELL, vol. 7, no. 4, 2005, pages 301 - 11, XP002508255, DOI: 10.1016/J.CCR.2005.03.003"
EP3912998A2,0,0,0,"LINDMO TBOVEN ECUTTITTA FFEDORKO JBUNN PA: ""Determination of the immunoreactive fraction of radiolabeled monoclonal antibodies by linear extrapolation to binding at infinite antigen excess"", J IMMUNOL METHODS, vol. 72, 1984, pages 77 - 89"
EP3912998A2,0,0,0,"MARKS ET AL., J MOL BIOL., vol. 222, no. 3, 5 December 1991 (1991-12-05), pages 581 - 97"
EP3912998A2,0,0,0,"MARKS ET AL., J. MOL. BIOL., vol. 222, no. 3, 5 December 1991 (1991-12-05), pages 581 - 97"
EP3912998A2,0,0,0,"MUSOLINO, JOURNAL OF CLINICAL ONCOLOGY, vol. 26, no. 11, pages 1789 - 1796"
EP3912998A2,0,0,0,"OGISO, H.ISHITANI, R. ET AL.: ""Crystal structure of the complex of human epidermal growth factor and receptor extracellular domains"", CELL, vol. 110, 2002, pages 775 - 787, XP002961395, DOI: 10.1016/S0092-8674(02)00963-7"
EP3912998A2,0,0,0,"OLAYIOYE MA ET AL., EMBO J, vol. 19, 2000, pages 3159 - 3167"
EP3912998A2,0,0,0,"PENG ET AL., PLOS ONE, vol. 8, 2013, pages 2 - 10"
EP3912998A2,0,0,0,"PENG, W.C.DE LAU W. ET AL.: ""Structure of Stem Cell Growth Factor R-spondin 1 in Complex with the Ectodomain of Its Receptor LGR5"", CELL REP 27, vol. 3, no. 6, 2013, pages 1885 - 1892, XP055299138, DOI: 10.1016/j.celrep.2013.06.009"
EP3912998A2,0,0,0,"PROG BIOPHYS MOL BIOL, vol. 118, no. 3, September 2015 (2015-09-01), pages 112 - 8"
EP3912998A2,0,0,0,"SANDERCOCK ET AL., MOLECULAR CANCER, 2015"
EP3912998A2,0,0,0,"SATO ET AL., GASTROENTEROLOGY, vol. 141, 2011, pages 1762 - 1772"
EP3912998A2,0,0,0,"SCHAEFER ET AL., CANCER CELL, vol. 20, 2011, pages 472 - 486"
EP3912998A2,0,0,0,"SESHAGIRI, S. ET AL., NATURE, vol. 485, 2012, pages 195 - 200"
EP3912998A2,0,0,0,"VAN DE WETERING ET AL., CELL, vol. 161, 2015, pages 933 - 45"
EP3912998A2,0,0,0,"VAN UHM JIVISSER GWVAN DER SCHANS MJGELDOF AAMEULEMAN EJNIEUWENHUIJZEN JA: ""The ultimate radiochemical nightmare: upon radio-iodination of Botulinum neurotoxin A, the introduced iodine atom itself seems to be fatal for the bioactivity of this macromolecule"", EJNMMI RES, vol. 5, 2015, pages 5"
EP3188375A3,0,0,0,"EL-BANNA AHMAD A AZIZ ET AL: ""Low complexityadaptive detection of distributed SFBC in open-loop CoMP"", 2014 IEEE SYMPOSIUM ON COMPUTERS AND COMMUNICATIONS (ISCC), IEEE, 23 June 2014 (2014-06-23), pages 1 - 5, XP032649875, DOI: 10.1109/ISCC.2014.6912569"
EP3188391A1,0,0,0,"CHRISTOS BOURAS ET AL: ""Enhancing reliable mobile multicasting with RaptorQ FEC"", COMPUTERS AND COMMUNICATIONS (ISCC), 2012 IEEE SYMPOSIUM ON, IEEE, 1 July 2012 (2012-07-01), pages 82 - 87, XP032209083, ISBN: 978-1-4673-2712-1, DOI: 10.1109/ISCC.2012.6249272"
EP3297724A2,0,0,0,0
EP3335763A1,0,0,0,None
EP3361873A1,0,0,0,0
EP3365373A2,0,0,0,0
EP3365373B1,0,0,0,None
EP3912998A3,0,0,0,0
EP3205321A1,0,0,0,0
EP3349790A1,0,0,0,0
EP3361873B1,0,0,0,None
EP3072739A1,0,0,0,0
EP3130401B1,0,0,0,None
EP3165967A1,0,0,0,0
EP3178747A1,0,0,0,0
EP3178747B1,0,0,0,None
EP3179669B1,0,0,0,None
EP3188180A1,0,0,0,"RICHARD SZELISK, COMPUTER VISION: ALGORITHMS AND APPLICATIONS, 2010, Retrieved from the Internet <URL:http://szeliski.org/Book/drafts/SzeliskiBook-20100903-draft.pdf>"
EP3188180B1,0,0,0,None
EP3188512A1,0,0,0,"MALHAM, D.G.: ""Higher order Ambisonic systems for the spatialisation of sound"", PROCEEDINGS, ICMC99, BEIJING, October 1999 (1999-10-01)"
EP3188512A1,0,0,0,"MICHAEL A. GERZON: ""Periphony: With-Height Sound Reproduction"", JOURNAL OF THE AUDIO ENGINEERING SOCIETY, vol. 21, no. 1, 1973, pages 2 - 10"
EP3225954A1,0,0,0,0
EP3225954B1,0,0,0,None
EP3236255A1,0,0,0,0
EP3241820A1,0,0,0,"BARVE P. ET AL.: ""Preparation of pure methyl esters from corresponding alkali metal salts of carboxylic acids using carbon dioxide and methanol"", INDUSTRIAL AND ENGINEERING CHEMISTRY RESEARCH, vol. 51, 2012, pages 1498 - 1505, XP055283100, DOI: doi:10.1021/ie200632v"
EP3241820A1,0,0,0,"CAINELLI G. ET AL.: ""The Use of Anion-Exchange Resins in the Synthesis of Esters from Carboxylic Acids and Alkylating Agents"", SYNTHESIS, 1975, pages 723 - 724"
EP3241820A1,0,0,0,"LIN S.K.C. ET AL.: ""Novel resin-based vacuum distillation-crystallisation method for recovery of succinic acid crystals from fermentation broths"", GREEN CHEMISTRY, vol. 12, 2010, pages 666 - 671, XP008137557, DOI: doi:10.1039/B913021G"
EP3241820A1,0,0,0,"LOPEZ-GARZON ET AL.: ""Direct downstream catalysis: From succinate to its diethyl ester without intermediate acidification"", CHEM. ENGINEERING JOURNAL, 2012, pages 200 - 202"
EP3241820A1,0,0,0,"LOPEZ-GARZON ET AL.: ""Green upgrading of succinate using dimethyl carbonate for a better integration with fermentative production"", CHEM. ENGINEERING JOURNAL, 2014, pages 235"
EP3241820A1,0,0,0,"ORJUELA A. ET AL.: ""A novel process for recovery of fermentation-derived succinic acid"", SEPARATION AND PURIFICATION TECHNOLOGY, vol. 83, 2011, pages 31 - 37, XP028329576, DOI: doi:10.1016/j.seppur.2011.08.010"
EP3241820A1,0,0,0,"PHAM, V. ET AL.: ""Techno-economic analysis of biomass to fuel conversion via the MixAlco process"", J. IND. MICROBIAL BIOTECHNOL., 2010, pages 1157, XP019809591"
EP3251725A1,0,0,0,0
EP3251725B1,0,0,0,None
EP3256047A1,0,0,0,0
EP3256047B1,0,0,0,0
EP3256766A1,0,0,0,0
EP3257231A1,0,0,0,0
EP3257741A1,0,0,0,0
EP3257866A1,0,0,0,"""Sustained and Controlled Release Drug Delivery Systems"", 1978, MARCEL DEKKER, INC."
EP3257866A1,0,0,0,"ANNE CHRISTINE W VOS ET AL: ""Anti Tumor Necrosis Factor- Antibodies Induce Regulatory Macrophages in an Fc Region-Dependent Manner"", GASTROENTEROLOGY, ELSEVIER, AMSTERDAM, NL, vol. 140, no. 1, 8 October 2010 (2010-10-08), pages 221 - 230.e3, XP028163969, ISSN: 0016-5085, [retrieved on 20101016], DOI: 10.1053/J.GASTRO.2010.10.008"
EP3257866A1,0,0,0,"BRUHNS ET AL., IMMUN. REV, vol. 268, 2015, pages 25 - 51"
EP3257866A1,0,0,0,"CIRO LEONARDO PIERRI ET AL: ""Molecular modeling of antibodies for the treatment of TNF [alpha] -related immunological diseases"", PHARMACOLOGY RESEARCH & PERSPECTIVES, vol. 4, no. 1, 15 February 2016 (2016-02-15), GB, pages e00197, XP055321446, ISSN: 2052-1707, DOI: 10.1002/prp2.197"
EP3257866A1,0,0,0,"CLAUDIA FERRARA ET AL: ""Unique carbohydrate-carbohydrate interactions are required for high affinity binding between Fc[gamma]RIII and antibodies lacking core fucose"", PROCEEDINGS OF THE NATIONAL ACADEMY OF SCIENCES OF THE UNITED STATES OF AMERICA, 2 August 2011 (2011-08-02), pages 12669 - 12674, XP055206253, Retrieved from the Internet <URL:http://www.jstor.org/stable/27979069> DOI: 10.1073/pnas.1108455108"
EP3257866A1,0,0,0,"DAVIS, J. M. ET AL., BIOCHEM, vol. 26, 1987, pages 1322 - 1326"
EP3257866A1,0,0,0,"DERKX B ET AL.: ""Tumour-necrosis-factor antibody treatment in Crohn's disease"", LANCET, vol. 342, no. 8864, 1993, pages 173 - 174, XP009069485, DOI: doi:10.1016/0140-6736(93)91375-V"
EP3257866A1,0,0,0,"GOEDE V ET AL.: ""Obinutuzumab plus chlorambucil in patients with CLL and coexisting conditions"", THE NEW ENGLAND JOURNAL OF MEDICINE, vol. 370, no. 12, 2014, pages 1101 - 1110"
EP3257866A1,0,0,0,"HEBUTERNE X ET AL.: ""Endoscopic improvement of mucosal lesions in patients with moderate to severe ileocolonic Crohn's disease following treatment with certolizumab pegol"", GUT, vol. 62, no. 2, 2013, pages 201 - 208"
EP3257866A1,0,0,0,"JONES, E. Y. ET AL., NATURE, vol. 338, 1989, pages 225 - 228"
EP3257866A1,0,0,0,"KABAT ET AL.: ""Sequences of Proteins of Immunological Interest"", 1991, NATIONAL INSTITUTES OF HEALTH"
EP3257866A1,0,0,0,"KAPUR R ET AL.: ""A prominent lack of IgGl-Fc fucosylation of platelet alloantibodies in pregnancy"", BLOOD, vol. 123, no. 4, 2014, pages 471 - 480"
EP3257866A1,0,0,0,"KAUFMAN; SHARP, MOL. BIOL., vol. 159, 1982, pages 601 - 621"
EP3257866A1,0,0,0,"KRAPP S; MIMURA Y; JEFFERIS R; HUBER R; SONDERMANN P: ""Structural analysis of human IgG-Fc glycoforms reveals a correlation between glycosylation and structural integrity"", JMOL BIOL, vol. 325, no. 5, 2003, pages 979 - 989, XP027092020, DOI: doi:10.1016/S0022-2836(02)01250-0"
EP3257866A1,0,0,0,"KRUIJSEN D ET AL.: ""Intranasal administration of antibody-bound respiratory syncytial virus particles efficiently primes virus-specific immune responses in mice"", JOURNAL OF VIROLOGY, vol. 87, no. 13, 2013, pages 7550 - 7557"
EP3257866A1,0,0,0,"LOUIS E ET AL: ""association betwwwn polymorphism in IgG Fc receptor IIIa coding gene and biological response to infliximab in Chron's disease"", ALIMENTARY PHARMACOLOGY & THERAPEUTICS, BLACKWELL SCIENTIFIC PUBLICATIONS LTD., CAMBRIDGE, GB, vol. 19, 1 March 2004 (2004-03-01), pages 511 - 519, XP002352324, ISSN: 0269-2813, DOI: 10.1111/J.1365-2036.2004.01871.X"
EP3257866A1,0,0,0,"MCRAE BL ET AL.: ""Fc Receptor-mediated Effector Function Contributes to the Therapeutic Response of Anti-TNF Monoclonal Antibodies in a Mouse Model of Inflammatory Bowel Disease"", J CROHNS COLITIS, vol. 10, no. 1, 2016, pages 69 - 76"
EP3257866A1,0,0,0,"MOSSER DM; EDWARDS JP: ""Exploring the full spectrum of macrophage activation"", NATURE REVIEWS. IMMUNOLOGY, vol. 8, no. 12, 2008, pages 958 - 969"
EP3257866A1,0,0,0,"NIWA R ET AL: ""IgG subclass-independent improvement of antibody-dependent cellular cytotoxicity by fucose removal from Asn<297>-linked oligosaccharides"", JOURNAL OF IMMUNOLOGICAL METHODS, ELSEVIER SCIENCE PUBLISHERS B.V.,AMSTERDAM, NL, vol. 306, no. 1-2, 30 November 2005 (2005-11-30), pages 151 - 160, XP027659262, ISSN: 0022-1759, [retrieved on 20051130]"
EP3257866A1,0,0,0,"NIWA, R. ET AL., J. IMMUNOL. METHODS, vol. 306, 2005, pages 151 - 160"
EP3257866A1,0,0,0,"OIKONOMOPOULOS A. ET AL., CURR DRUG TARGETS, vol. 14, no. 12, November 2013 (2013-11-01), pages 1421 - 1432"
EP3257866A1,0,0,0,"PENNICA, D. ET AL., NATURE, vol. 312, 1984, pages 724 - 729"
EP3257866A1,0,0,0,"RAJU, T. S., BIOPROCESS INT., vol. 1, 2003, pages 44 - 53"
EP3257866A1,0,0,0,"READ S; POWRIE F: ""Current protocols in immunology"", 2001, article ""Induction of inflammatory bowel disease in immunodeficient mice by depletion of regulatory T cells"""
EP3257866A1,0,0,0,"ROUTIER, F. H., GLYCOCONJUGATE J, vol. 14, 1997, pages 201 - 207"
EP3257866A1,0,0,0,"RUTGEERTS P ET AL.: ""Adalimumab induces and maintains mucosal healing in patients with Crohn's disease: data from the EXTEND trial."", GASTROENTEROLOGY, vol. 142, no. 5, 2012, pages 1102 - 1111, XP028415825, DOI: doi:10.1053/j.gastro.2012.01.035"
EP3257866A1,0,0,0,"RUTGEERTS P ET AL.: ""Scheduled maintenance treatment with infliximab is superior to episodic treatment for the healing of mucosal ulceration associated with Crohn's disease."", GASTROINTESTINAL ENDOSCOPY, vol. 63, no. 3, 2006, pages 433 - 442, XP005314773, DOI: doi:10.1016/j.gie.2005.08.011"
EP3257866A1,0,0,0,"SATOH MITSUO ET AL: ""NON-FUCOSYLATED THERAPEUTIC ANTIBODIES AS NEXT-GENERATION THERAPEUTIC ANTIBODIES"", EXPERT OPINION ON BIOLOGICAL THERAPY, INFORMA HEALTHCARE, ASHLEY, LONDON; GB, vol. 6, no. 11, 1 November 2006 (2006-11-01), pages 1161 - 1173, XP008078583, ISSN: 1471-2598, DOI: 10.1517/14712598.6.11.1161"
EP3257866A1,0,0,0,"SCHASFOORT ET AL., ANAL BIOCHEM., vol. 439, no. 1, 2013, pages 4 - 6"
EP3257866A1,0,0,0,"SHIELDS RL ET AL.: ""Lack of fucose on human IgG1 N-linked oligosaccharide improves binding to human Fcgamma RIII and antibody-dependent cellular toxicity"", THE JOURNAL OF BIOLOGICAL CHEMISTRY, vol. 277, no. 30, 2002, pages 26733 - 26740, XP002689094, DOI: doi:10.1074/jbc.M202069200"
EP3257866A1,0,0,0,"SHINKAWA, T. ET AL., J BIOL CHEM, vol. 278, 2003, pages 3466 - 3473"
EP3257866A1,0,0,0,"SUTTERWALA FS; NOEL GJ; CLYNES R; MOSSER DM: ""Selective suppression of interleukin-12 induction after macrophage receptor ligation"", THE JOURNAL OF EXPERIMENTAL MEDICINE, vol. 185, no. 11, 1997, pages 1977 - 1985, XP002921656, DOI: doi:10.1084/jem.185.11.1977"
EP3257866A1,0,0,0,"SUTTERWALA FS; NOEL GJ; SALGAME P; MOSSER DM: ""Reversal of proinflammatory responses by ligating the macrophage Fcgamma receptor type I"", THE JOURNAL OF EXPERIMENTAL MEDICINE, vol. 188, no. 1, 1998, pages 217 - 222, XP002921657, DOI: doi:10.1084/jem.188.1.217"
EP3257866A1,0,0,0,"UMANA, P. ET AL., NATURE BIOTECHNOL., vol. 17, 1999, pages 176 - 180"
EP3257866A1,0,0,0,"URLAUB; CHASIN, PROC. NATL. ACAD. SCI. USA, vol. 77, 1980, pages 4216 - 4220"
EP3257866A1,0,0,0,"VAN OERS MH: ""CD20 antibodies: type II to tango?"", BLOOD, vol. 119, no. 22, 2012, pages 5061 - 5063, XP055266601, DOI: doi:http://dx.doi.org/10.1182/blood-2012-04-420711"
EP3257866A1,0,0,0,"VINK T; OUDSHOORN-DICKMANN M; ROZA M; REITSMA JJ; DE JONG RN: ""A simple, robust and highly efficient transient expression system for producing antibodies"", METHODS, vol. 65, no. 1, 2014, pages 5 - 10, XP055291809, DOI: doi:10.1016/j.ymeth.2013.07.018"
EP3257866A1,0,0,0,"VOS AC ET AL.: ""Anti-tumor necrosis factor-alpha antibodies induce regulatory macrophages in an Fc region-dependent manner"", GASTROENTEROLOGY, vol. 140, no. 1, 2011, pages 221 - 230, XP027560021"
EP3257866A1,0,0,0,"VOS AC ET AL.: ""Regulatory macrophages induced by infliximab are involved in healing in vivo and in vitro"", INFLAMMATORY BOWEL DISEASES, vol. 18, no. 3, 2012, pages 401 - 408, XP009163005, DOI: doi:10.1002/ibd.21818"
EP3257866A1,0,0,0,"VOS ANNE CHRISTINE W ET AL: ""Regulatory macrophages induced by infliximab are involved in healing in vivo and in vitro"", INFLAMMATORY BOWEL DISEASES, JOHN WILEY & SONS, INC, UNITED STATES, vol. 18, no. 3, 1 March 2012 (2012-03-01), pages 401 - 408, XP009163005, ISSN: 1536-4844, [retrieved on 20110920], DOI: 10.1002/IBD.21818"
EP3271479A1,0,0,0,0
EP3286388B1,0,0,0,None
EP3297996A1,0,0,0,0
EP3298538B1,0,0,0,None
EP3298539A1,0,0,0,0
EP3301175A1,0,0,0,"S. GUO ET AL: ""MicroRNA miR-125a controls hematopoietic stem cell number"", PROCEEDINGS OF THE NATIONAL ACADEMY OF SCIENCES, vol. 107, no. 32, 10 August 2010 (2010-08-10), pages 14229 - 14234, XP055011642, ISSN: 0027-8424, DOI: 10.1073/pnas.0913574107"
EP3301175A1,0,0,0,"WOJTOWICZ EDYTA E ET AL: ""Ectopic miR-125a Expression Induces Long-Term Repopulating Stem Cell Capacity in Mouse and Human Hematopoietic Progenitors"", CELL STEM CELL, ELSEVIER, CELL PRESS, AMSTERDAM, NL, vol. 19, no. 3, 14 July 2016 (2016-07-14), pages 383 - 396, XP029711987, ISSN: 1934-5909, DOI: 10.1016/J.STEM.2016.06.008"
EP3302081B1,0,0,0,0
EP3302744B1,0,0,0,None
EP3303625A1,0,0,0,0
EP3344768B1,0,0,0,None
EP3365353A1,0,0,0,0
EP3376873B1,0,0,0,None
EP3376875B1,0,0,0,None
EP3386396B1,0,0,0,None
EP3394633A1,0,0,0,0
EP3485737A1,0,0,0,0
EP3555275A1,0,0,0,0
EP3599755A1,0,0,0,"""3rd Generation Partnership Project; Technical Specification Group Services and System Aspects; Architecture enhancements for non-3GPP accesses (Release 13)"", 3GPP TS 23.402, vol. SA WG2, no. V13.3.0, 17 September 2015 (2015-09-17), pages 1 - 298, XP050996016"
EP3599755A1,0,0,0,"""3rd Generation Partnership Project; Technical Specification Group Services and System Aspects; Study on architecture enhancements to support Proximity-based Services (ProSe) (Release 12)"", 3GPP TR 23.703, vol. SA WG2, no. V1.1.0, 28 January 2014 (2014-01-28), pages 1 - 324, XP050729424"
EP3072739B1,0,0,0,None
EP3072739B8,0,0,0,0
EP3130401A1,0,0,0,0
EP3136684A1,0,0,0,"""Software-Defined Networking: The New Norm for Networks"", OPEN NETWORKING FOUNDATION (ONF, 13 April 2012 (2012-04-13)"
EP3136684A1,0,0,0,"""TRANSMISSION CONTROL PROTOCOL DARPA INTERNET PROGRAM PROTOCOL SPECIFICATION"", RFC 793, September 1981 (1981-09-01)"
EP3136684B1,0,0,0,None
EP3179669A1,0,0,0,"""Chapter 12: Key Establishment Protocols ED - Menezes A J; Van Oorschot P C; Vanstone S A"", 1 October 1996 (1996-10-01), XP001525012, ISBN: 978-0-8493-8523-0, Retrieved from the Internet <URL:http://www.cacr.math.uwaterloo.ca/hac/>"
EP3179669A1,0,0,0,"ANONYMOUS: ""Marlin Architecture Overview"", 31 December 2007 (2007-12-31), pages 1 - 27, XP002625843, Retrieved from the Internet <URL:http://www.marlin-community.com/public/MarlinArchitectureOverview.pdf> [retrieved on 20110303]"
EP3179669A1,0,0,0,"INTERTRUST: ""Marlin Broadband Architecture Overview"", 5 November 2007 (2007-11-05), XP055022449, Retrieved from the Internet <URL:http://www.marlin-community.com/public/MarlinBroadbandArchitectureOverview.pdf> [retrieved on 20120320]"
EP3179669A1,0,0,0,"MARLIN STARFISH, MARLIN DEVELOPER COMMUNITY, 22 August 2006 (2006-08-22)"
EP3179669A1,0,0,0,"QIN-LONG HUANG ET AL: ""Secure and privacy-preserving DRM scheme using homomorphic encryption in cloud computing"", JOURNAL OF CHINA UNIVERSITIES OF POSTS AND TELECOMMUNICATIONS, vol. 20, no. 6, 1 December 2013 (2013-12-01), CN, pages 88 - 95, XP055271061, ISSN: 1005-8885, DOI: 10.1016/S1005-8885(13)60113-2"
EP3179669A1,0,0,0,"VANESA DAZA ET AL: ""A Distributed and Computationally Secure Key Distribution Scheme"", INTERNATIONAL ASSOCIATION FOR CRYPTOLOGIC RESEARCH,, vol. 20030411:085507, 1 June 2002 (2002-06-01), pages 1 - 16, XP061000299"
EP3242950B1,0,0,0,"DE BOER P ET AL: ""Highly efficient gene targeting in Penicillium chrysogenum using the bi-partite approach in DELTAlig4 or DELTAku70 mutants"", FUNGAL GENETICS AND BIOLOGY, SAN DIEGO, CA, US, vol. 47, no. 10, 1 October 2010 (2010-10-01), pages 839 - 846, XP027264914, ISSN: 1087-1845, [retrieved on 20100724]"
EP3242950B1,0,0,0,"JAVIER CASQUEIRO ET AL: ""Gene Targeting in Penicillium chrysogenum: Disruption of the lys2 Gene Leads to Penicillin Overproduction"", JOURNAL OF BACTERIOLOGY, 15 February 1999 (1999-02-15), United States, pages 1181 - 1188, XP055493015, Retrieved from the Internet <URL:http://jb.asm.org/content/181/4/1181.full.pdf>"
EP3242950B1,0,0,0,"KRAPPMANN S ET AL: ""GENE TARGETING IN ASPERGILLUS FUMOGATUS BY HOMOLOGOUS RECOMBINATION IS FACILITATED IN A NONHOMOLOGOUS END- JOINING-DEFICIENT GENETIC BACKGROUND"", EUKARYOTIC, AMERICAN SOCIETY FOR MICROBIOLOGY, US, vol. 5, no. 1, 1 January 2006 (2006-01-01), pages 212 - 215, XP009063272, ISSN: 1535-9778, DOI: 10.1128/EC.5.1.212-215.2006"
EP3242950B1,0,0,0,"OLDENBURG K R ET AL: ""Recombination-mediated PCR-directed plasmid construction in vivo in yeast"", 19970115, vol. 25, no. 2, 15 January 1997 (1997-01-15), pages 451 - 452, XP002990102, ISSN: 0305-1048, DOI: 10.1093/NAR/25.2.451"
EP3242950B1,0,0,0,"TAKAYUKI ARAZOE ET AL: ""Site-specific DNA double-strand break generated by I-SceI endonuclease enhances ectopic homologous recombination in Pyricularia oryzae"", FEMS MICROBIOLOGY LETTERS, vol. 352, no. 2, 26 February 2014 (2014-02-26), GB, pages 221 - 229, XP055256149, ISSN: 0378-1097, DOI: 10.1111/1574-6968.12396"
EP3244590A1,0,0,0,"SOURLAS VASILIS ET AL: ""Distributed Cache Management in Information-Centric Networks"", IEEE TRANSACTIONS ON NETWORK AND SERVICE MANAGEMENT, IEEE, US, vol. 10, no. 3, 1 September 2013 (2013-09-01), pages 286 - 299, XP011526912, ISSN: 1932-4537, [retrieved on 20130913], DOI: 10.1109/TNSM.2013.052113.120382"
EP3244590A1,0,0,0,"ZHANG ET AL.: ""Named data networking"", ACM SIGCOMM COMPUTER COMMUNICATION REVIEW, vol. 44, no. 3, July 2014 (2014-07-01), pages 66 - 73"
EP3244590A1,0,0,0,"ZHANG GUOQIANG ET AL: ""Caching in information centric networking: A survey"", COMPUTER NETWORKS, vol. 57, no. 16, 13 November 2013 (2013-11-13), pages 3128 - 3141, XP028744689, ISSN: 1389-1286, DOI: 10.1016/J.COMNET.2013.07.007"
EP3244590A1,0,0,0,"ZHONGXING MING; MINGWEI XU; DAN WANG.: ""23rd International Conference on Computer Communication and Networks"", 2014, IEEE, article ""Age-based cooperative caching in information-centric networking"""
EP3244590B1,0,0,0,None
EP3256513A1,0,0,0,0
EP3256513B1,0,0,0,0
EP3256766B1,0,0,0,None
EP3257741B1,0,0,0,0
EP3259435A2,0,0,0,0
EP3259836A1,0,0,0,0
EP3259836B1,0,0,0,None
EP3261716A1,0,0,0,0
EP3261716B1,0,0,0,0
EP3265552A2,0,0,0,0
EP3268058A1,0,0,0,0
EP3274301A1,0,0,0,"ARAN H C ET AL: ""Carbon nanofibers in catalytic membrane microreactors"", JOURNAL OF MEMBRANE SCIENCE, ELSEVIER BV, NL, vol. 381, no. 1, 24 July 2011 (2011-07-24), pages 244 - 250, XP028274028, ISSN: 0376-7388, [retrieved on 20110729], DOI: 10.1016/J.MEMSCI.2011.07.037"
EP3274301A1,0,0,0,See also references of WO2016156273A1
EP3274463A1,0,0,0,0
EP3279665B1,0,0,0,None
EP3283035A1,0,0,0,0
EP3283688A1,0,0,0,0
EP3296095A1,0,0,0,0
EP3297417A1,0,0,0,0
EP3297995A1,0,0,0,0
EP3298538A1,0,0,0,0
EP3302081A1,0,0,0,0
EP3302744A1,0,0,0,0
EP3307279A1,0,0,0,0
EP3307279B1,0,0,0,None
EP3319393B1,0,0,0,None
EP3326395A1,0,0,0,0
EP3334451A1,0,0,0,0
EP3334451B1,0,0,0,None
EP3334927A1,0,0,0,0
EP3341687A1,0,0,0,0
EP3344477A1,0,0,0,0
EP3344477B1,0,0,0,None
EP3368407A1,0,0,0,0
EP3371978B1,0,0,0,None
EP3376874A1,0,0,0,0
EP3376876B1,0,0,0,None
EP3383258A1,0,0,0,0
EP3384275A2,0,0,0,0
EP3384725A1,0,0,0,0
EP3384725B1,0,0,0,None
EP3398130A1,0,0,0,0
EP3398297A1,0,0,0,0
EP3085230A1,0,0,0,0
EP3199019A1,0,0,0,0
EP3242950A1,0,0,0,0
EP3251664A1,0,0,0,"ANISIMOV ET AL., CELL CYCLE, vol. 7, 2008, pages 2769"
EP3251664A1,0,0,0,"ARJUNE SITA ET AL: ""Involvement of the Cys-Tyr cofactor on iron binding in the active site of human cysteine dioxygenase"", AMINO ACIDS, SPRINGER VERLAG, AU, vol. 47, no. 1, 27 September 2014 (2014-09-27), pages 55 - 63, XP035418059, ISSN: 0939-4451, [retrieved on 20140927], DOI: 10.1007/S00726-014-1843-7"
EP3251664A1,0,0,0,"BJEDOV ET AL., CELL METAB, vol. 11, 2010, pages 35"
EP3251664A1,0,0,0,"CHAI SERGIO C ET AL: ""Heterologous expression, purification, and characterization of recombinant rat cysteine dioxygenase"", THE JOURNAL OF BIOLOGICAL CHEMISTRY 18 MAR 2005, vol. 280, no. 11, 18 March 2005 (2005-03-18), pages 9865 - 9869, XP002763974, ISSN: 0021-9258"
EP3251664A1,0,0,0,"CHAI SERGIO C ET AL: ""Probes of the catalytic site of cysteine dioxygenase"", THE JOURNAL OF BIOLOGICAL CHEMISTRY 9 JUN 2006, vol. 281, no. 23, 9 June 2006 (2006-06-09), pages 15774 - 15779, XP002763973, ISSN: 0021-9258"
EP3251664A1,0,0,0,"FRASER ET AL., NATURE, vol. 408, 2000, pages 325 - 30"
EP3251664A1,0,0,0,"GOOT ET AL., TRENDS MOL MED, vol. 19, no. 6, 2013, pages 336 - 44"
EP3251664A1,0,0,0,"GUIDETTI ET AL., NEUROBIOL DIS, vol. 17, no. 3, 2004, pages 455 - 461"
EP3251664A1,0,0,0,"HARRISON ET AL., NATURE, vol. 460, 2009, pages 392 - 395"
EP3251664A1,0,0,0,"HEAFIELD, NEUROSCIENCE LETTERS, vol. 110, no. 21, 1990, pages 6 - 220"
EP3251664A1,0,0,0,"HOUTKOOPER ET AL., CELL, vol. 142, 2010, pages 9"
EP3251664A1,0,0,0,"KUMAR JITENDRA ET AL: ""Silymarin extends lifespan and reduces proteotoxicity in C. elegans Alzheimer's model"", CNS & NEUROLOGICAL DISORDERS DRUG TARGETS 2015, vol. 14, no. 2, 2015, pages 295 - 302, XP009192408, ISSN: 1996-3181"
EP3251664A1,0,0,0,"KWON DO YOUNG ET AL: ""Alterations in sulfur amino acid metabolism in mice treated with silymarin: a novel mechanism of its action involved in enhancement of the antioxidant defense in liver"", PLANTA MEDICA AUG 2013, vol. 79, no. 12, August 2013 (2013-08-01), pages 997 - 1002, XP002764023, ISSN: 1439-0221"
EP3251664A1,0,0,0,"LIAO VIVIAN HSIU-CHUAN ET AL: ""Curcumin-mediated lifespan extension in Caenorhabditis elegans"", MECHANISMS OF AGEING AND DEVELOPMENT OCT 2011, vol. 132, no. 10, October 2011 (2011-10-01), pages 480 - 487, XP002764051, ISSN: 1872-6216"
EP3251664A1,0,0,0,"MAIR ET AL., NATURE, vol. 470, 2011, pages 404 - 408"
EP3251664A1,0,0,0,"MONTGOMERY AMANDA ET AL: ""Effect of Curcumin and Silymarin in Combination Exerts Synergistic Inhibition of Colon Cancer Cell Proliferation"", FASEB JOURNAL, vol. 29, no. Suppl. 1, April 2015 (2015-04-01), EXPERIMENTAL BIOLOGY MEETING 2015; BOSTON, MA, USA; MARCH 28 -APRIL 01, 2015, pages 721.2, XP002764050"
EP3251664A1,0,0,0,"OPITZ ET AL., NATURE, vol. 478, no. 7368, 2011, pages 197 - 203"
EP3251664A1,0,0,0,"OXENKRUG MOL NEUROBIOL, vol. 52, no. 2, 2015, pages 805 - 10"
EP3251664A1,0,0,0,"PEARSON ET AL., CELL METAB, vol. 8, 2008, pages 157 - 168"
EP3251664A1,0,0,0,"PEREZ ET AL: ""Pathomolecular effects of homocysteine on the aging process: A new theory of aging"", MEDICAL HYPOTHESES, EDEN PRESS, PENRITH, US, vol. 69, no. 1, 10 May 2007 (2007-05-10), pages 149 - 160, XP022064826, ISSN: 0306-9877, DOI: 10.1016/J.MEHY.2006.10.056"
