publication_number,patent_citation,publication_date,assignee,title
EP3552486A1,CA2893251C,2016-10-18,Julie Anne Haught,Protective device for the head and ears of an animal
EP3552487A1,WO2021185412A1,2021-09-23,Highland Stall & Weide GmbH,Grazing animal farming method and grazing animal farming arrangement
EP3553506A2,US11058895B2,2021-07-13,Daegu Gyeongbuk Institute Of Science And Technology,Collimator and medical robot including the same
EP3553506A2,CN112823280A,2021-05-18,斯格瑞公司,System and method for depth-selectable X-ray analysis
EP3553506A2,US11143605B2,2021-10-12,"Sigray, Inc.",System and method for computed laminography x-ray fluorescence imaging
EP3553506A2,US11175243B1,2021-11-16,"Sigray, Inc.",X-ray dark-field in-line inspection for semiconductor samples
EP3553506A2,US11215572B2,2022-01-04,"Sigray, Inc.",System and method for x-ray absorption spectroscopy using a crystal analyzer and a plurality of detector elements
EP3553506A2,CN111992514A,2020-11-27,北京霍里思特科技有限公司,Double-light-source signal acquisition unit and signal acquisition method of wide intelligent sorting equipment
EP3553509A1,US10753890B2,2020-08-25,Malvern Panalytical B.V.,High resolution X-ray diffraction method and apparatus
EP3553958B1,US11038553B2,2021-06-15,Nxp B.V.,EMC inductor-free RF front-end method and topology with power by field function for an inductively coupled communication system
EP3553958B1,CN111934725B,2021-03-19,深圳市汇顶科技股份有限公司,Near field communication device and electronic equipment
EP3553959B1,US10812199B1,2020-10-20,Nxp B.V.,Quality-factor control for a near-field wireless device
EP3553959B1,US20210242908A1,2021-08-05,Nxp B.V.,Near-field electromagnetic induction (nfemi) antenna
EP3553999A1,US20190318118A1,2019-10-17,International Business Machines Corporation,Secure encrypted document retrieval
EP3553999A1,CN111832050B,2021-03-26,深圳致星科技有限公司,Paillier encryption scheme based on FPGA chip implementation for federal learning
EP3556255A1,0,0,0,0
EP3556255B1,0,0,0,0
EP3556264A1,CA3013605A1,2019-03-19,Zmc Metal Coating Inc.,Roller blind end bracket with retaining member
EP3556264A1,CA3090663A1,2019-08-15,"Mcs Industries, Inc.",Hanging system and bracket thereof
EP3556264A1,WO2021038389A1,2021-03-04,3M Innovative Properties Company,Wall anchors and assemblies for heavyweight objects
EP3556264B1,CA3013605A1,2019-03-19,Zmc Metal Coating Inc.,Roller blind end bracket with retaining member
EP3556264B1,CA3090663A1,2019-08-15,"Mcs Industries, Inc.",Hanging system and bracket thereof
EP3556264B1,WO2021038389A1,2021-03-04,3M Innovative Properties Company,Wall anchors and assemblies for heavyweight objects
EP3560378A1,0,0,0,0
EP3560888A1,0,0,0,0
EP3560978A1,WO2021096654A1,2021-05-20,Sabic Global Technologies B.V.,Curing composition for high heat adhesive epoxy resin
EP3560979B1,WO2020180974A1,2020-09-10,Sabic Global Technologies B.V.,Thermoset epoxy composition with aromatic dianhydride powder as curing agent
EP3561201B1,CN111042629A,2020-04-21,中国化学工程第三建设有限公司,Construction method for high-altitude assembly of large steel chimney
EP3561453A1,DE102020111873A1,2021-11-04,Bayerische Motoren Werke Aktiengesellschaft,Providing an expected driving path
EP3561454A2,0,0,0,0
EP3561705A1,US11030346B2,2021-06-08,Ememory Technology Inc.,Integrated circuit and data processing method for enhancing security of the integrated circuit
EP3561705B1,US11030346B2,2021-06-08,Ememory Technology Inc.,Integrated circuit and data processing method for enhancing security of the integrated circuit
EP3562087B1,US10536344B2,2020-01-14,"Cisco Technology, Inc.",Privacy-aware model generation for hybrid machine learning systems
EP3562087B1,US10616343B1,2020-04-07,Motorola Mobility Llc,Center console unit and corresponding systems and methods
EP3563908A1,FR3103898A1,2021-06-04,Abeo,Device for controlling an anchor for fixing sports or leisure equipment
EP3564054B1,0,0,0,0
EP3564685A1,US10837753B2,2020-11-17,"Allegro Microsystems, Llc",Magnetic field sensor using MR elements for detecting flux line divergence
EP3565201A1,WO2021061728A1,2021-04-01,Carrier Corporation,System and method for sending and receiving an ethernet signal
EP3565201A1,US11108842B2,2021-08-31,Nxp B.V.,Wired communications device and method for operating a wired communications device
EP3565201A1,CN113438052A,2021-09-24,深圳市元征未来汽车技术有限公司,"Signal decoding method, device, electronic equipment and storage medium"
EP3567068A1,EP3885393A1,2021-09-29,SHPP Global Technologies B.V.,"Modified poly(phenylene ether) copolymers, compositions, and methods thereof"
EP3567068A1,CN109563263B,2021-11-23,高新特殊工程塑料全球技术有限公司,Phenylene ether copolymers and compositions comprising the same
EP3567068A1,CN112898561A,2021-06-04,大连理工大学,Maleimide-terminated polyphenylene ether and preparation method thereof
EP3567873A1,EP3742759A1,2020-11-25,Sivantos Pte. Ltd.,Hearing aid and method for operating same
EP3567873A1,US11102576B2,2021-08-24,"Knowles Electronicis, LLC",Audio device with audio signal processing based on acoustic valve state
EP3567873A1,US10939215B2,2021-03-02,Sonova Ag,"Avoidance of user discomfort due to pressure differences by vent valve, and associated systems and methods"
EP3567873A1,EP3799443A1,2021-03-31,Sonova AG,Hearing device comprising an active vent and method for its operation
EP3567873A1,EP3937514A1,2022-01-12,GN Hearing A/S,Hearing device with active vent click compensation
EP3569221A1,0,0,0,0
EP3569427A1,US10994782B2,2021-05-04,Western Trailer Co.,Method and apparatus for attaching crossmembers to a pair of flanged beams
EP3569433A1,0,0,0,0
EP3569915B1,CN112082035B,2021-03-26,无锡市正丰建设工程有限公司,Pipeline emergency pipe blocking air bag device and pipeline non-stop maintenance method
EP3569983A1,CN112597670A,2021-04-02,武汉理工大学,Data input method and device of rainstorm flood management model software
EP3569983A1,WO2017160276A1,2017-09-21,Ford Global Technologies Llc,"Multi-day, multi-person, and multi-modal trip planning system"
EP3569983A1,US10598499B2,2020-03-24,Kabushiki Kaisha Toshiba,Method and device for accelerated map-matching
EP3569983A1,US11153717B2,2021-10-19,Qualcomm Incorporated,Enhanced reporting of positioning-related states
EP3569983A1,US11164330B2,2021-11-02,"Applied Research Associates, Inc.",Landmark configuration matcher
EP3569984A1,CN113077643A,2021-07-06,上海振华重工(集团)股份有限公司,"Traffic control method, traffic control system and storage medium"
EP3569984A1,US11099561B1,2021-08-24,"Zoox, Inc.",Control of an autonomous vehicle in unmapped regions
EP3570202A2,EP3790201A1,2021-03-10,Nxp B.V.,Nfc device and method of operating the same
EP3570202A2,CN112532551A,2021-03-19,北京紫光青藤微系统有限公司,Clock calibration method of communication device and communication device
EP3571931A1,0,0,0,0
EP3572381B1,0,0,0,0
EP3573232A1,0,0,0,0
EP3574761B1,0,0,0,0
EP3574854A1,0,0,0,0
EP3574854B1,0,0,0,0
EP3575188A1,0,0,0,0
EP3575199B1,NL2024947B1,2021-10-06,Itrec Bv,Hands off monopile hoisting tool
EP3575199B1,EP3929070A1,2021-12-29,OSK-ShipTech A/S,A monopile fastening device
EP3575231A1,0,0,0,0
EP3575702A1,0,0,0,0
EP3576291A1,0,0,0,0
EP3577087B1,0,0,0,0
EP3578754A1,US11199643B2,2021-12-14,"Halliburton Energy Services, Inc.",Machine learning approach for identifying mud and formation parameters based on measurements made by an electromagnetic imager tool
EP3578924A2,US10890663B2,2021-01-12,"Zoox, Inc.",Loading multi-resolution maps for localization
EP3579457A1,0,0,0,0
EP3581027A1,CN112586397A,2021-04-02,赣州朝歌科技有限公司,"A jack for birds, beasts and eggs are gathered"
EP3581729A1,0,0,0,0
EP3581888A1,0,0,0,0
EP3582434A1,CN110188053B,2020-12-01,北京润科通用技术有限公司,Airborne data bus delay fault injection equipment and method
EP3582434A1,US11244046B2,2022-02-08,Nuvoton Technology Corporation,Data-sampling integrity check using gated clock
EP3582469A1,0,0,0,0
EP3583832A1,0,0,0,0
EP3583890A2,WO2021198045A1,2021-10-07,Koninklijke Philips N.V.,Controller and method for inductive sensing
EP3583896A1,WO2021198045A1,2021-10-07,Koninklijke Philips N.V.,Controller and method for inductive sensing
EP3584964B1,0,0,0,0
EP3587682A1,0,0,0,0
EP3587720A1,0,0,0,0
EP3587726A1,TWI735132B,2021-08-01,光群實業股份有限公司,Hot piece of fire and smoke prevention and rolling door with the door piece
EP3587779A2,US10795349B2,2020-10-06,Iav Gmbh Ingenieurgesellschaft Auto Und Verkehr,Method and device for testing software of an electronic control unit of a vehicle
EP3587779A3,US10795349B2,2020-10-06,Iav Gmbh Ingenieurgesellschaft Auto Und Verkehr,Method and device for testing software of an electronic control unit of a vehicle
EP3588238B1,EP3511796B1,2021-06-30,Nxp B.V.,A linear regulator with a common resistance
EP3588238B1,US11251789B1,2022-02-15,"Semiconductor Components Industries, Llc",Instability management in a signal driver circuit
EP3590324A1,0,0,0,0
EP3590324B1,0,0,0,0
EP3591035A1,EP3431582A1,2019-01-23,Koninklijke Philips N.V.,Cell culturing materials
EP3591035A1,EP3798300A1,2021-03-31,Koninklijke Philips N.V.,Cell culturing materials
EP3591035A1,EP3825004A1,2021-05-26,Koninklijke Philips N.V.,New multi-functional fluidic device for clamping biopsies
EP3591339A2,US11087469B2,2021-08-10,Here Global B.V.,"Method, apparatus, and system for constructing a polyline from line segments"
EP3591339A2,US11193776B2,2021-12-07,"TerriTool, LLC",Route optimization systems and methods
EP3591339A3,US11087469B2,2021-08-10,Here Global B.V.,"Method, apparatus, and system for constructing a polyline from line segments"
EP3591339A3,US11193776B2,2021-12-07,"TerriTool, LLC",Route optimization systems and methods
EP3591361B1,CN113945295A,2022-01-18,广东则成科技有限公司,Flexible thermopile sensor and method of making same
EP3591841A1,JP6729790B2,2020-07-22,株式会社村田製作所,High frequency module
EP3591841A1,US10845396B2,2020-11-24,Texas Instruments Incorporated,Apparatus and system for wide-range current sensing
EP3591841A1,US11018417B2,2021-05-25,Nxp B.V.,Short circuit detection apparatus for resonant antenna networks and methods therefor
EP3591842A1,0,0,0,0
EP3591842B1,0,0,0,0
EP3591889B1,0,0,0,0
EP3594440A1,0,0,0,0
EP3594711A1,EP3672185A1,2020-06-24,HERE Global B.V.,Identifying potentially manipulated radio signals and/or radio signal parameters
EP3594711A1,EP3672304A1,2020-06-24,HERE Global B.V.,Statistical analysis of mismatches for spoofing detection
EP3594711A1,EP3671252A1,2020-06-24,HERE Global B.V.,Identifying potentially manipulated radio signals and/or radio signal parameters based on a first radio map information and a second radio map information
EP3594912A1,US11037436B2,2021-06-15,Stmicroelectronics S.R.L.,Three-level motion detector using accelerometer device in key fob application
EP3595412A1,0,0,0,0
EP3596656B1,JP2020149175A,2020-09-17,トヨタ自動車株式会社,Driving control system
EP3596656B1,US11134217B1,2021-09-28,Surendra Goel,System that provides video conferencing with accent modification and multiple video overlaying
EP3597564A1,USD909627S1,2021-02-02,H. D. Duijts Holding B.V.,Holder for building panels
EP3598640A1,0,0,0,0
EP3598646A1,US10868551B1,2020-12-15,Nxp B.V.,Non-intrusive fault detection for phase-locked loop
EP3599526A1,0,0,0,0
EP3599781A1,0,0,0,0
EP3599781B1,0,0,0,0
EP3599956B1,EP3536205B1,2021-06-02,Vorwerk & Co. Interholding GmbH,Food preparation apparatus
EP3605117A1,0,0,0,0
EP3605476A1,0,0,0,0
EP3605844A1,0,0,0,0
EP3605854B1,US10893492B2,2021-01-12,"Maxim Integrated Products, Inc.",Near field communication reader with dynamic power control
EP3605854B1,KR20200102765A,2020-09-01,삼성전자주식회사,A wireless communication device for detecting card
EP3605872A1,US11170640B2,2021-11-09,"Ford Global Technologies, Llc",Method and apparatus for bridging and optimizing V2X networks
EP3605872A1,US20210235240A1,2021-07-29,"Ford Global Technologies, Llc",Method and apparatus for bridging and optimizing v2x networks in vehicles
EP3605872A1,CN111489589A,2020-08-04,中车青岛四方机车车辆股份有限公司,"Vehicle anti-collision method, device, equipment and storage medium"
EP3608662A1,US11130424B2,2021-09-28,"Ford Global Technologies, Llc",Vehicle seating assembly having capacitive proximity sensor
EP3608662A1,CN111487304B,2021-12-17,欧阳彬,Apparatus and method for monitoring gas concentration and sensor
EP3610836B1,0,0,0,0
EP3611537A2,0,0,0,0
EP3613294A3,CN112586491A,2021-04-02,李琳超,Device and method for preparing mouse intestine volume label book
EP3613557A1,0,0,0,0
EP3614046A1,0,0,0,0
EP3614046B1,0,0,0,0
EP3614227A2,US10958162B1,2021-03-23,"Vidatronic, Inc.",Dual-loop regulated switched capacitor DC-DC converter
EP3614292A1,0,0,0,0
EP3617010B1,0,0,0,0
EP3617436A1,0,0,0,0
EP3618248A1,0,0,0,0
EP3620136A1,EP3760169A1,2021-01-06,WE Design Beheer B.V.,Thumb brace
EP3620136A1,EP3838233A1,2021-06-23,Manometric Holding B.V.,Orthosis for placement on a human hand
EP3620136A1,US10888143B2,2021-01-12,Smart International Enterprises Inc.,Ergonomic wristband for a wrist wearable device such as a smartwatch
EP3620413A1,0,0,0,0
EP3620571B1,0,0,0,0
EP3620604A1,0,0,0,0
EP3620971A1,EP3895949A1,2021-10-20,Toyota Jidosha Kabushiki Kaisha,Method and device for evaluating user discomfort
EP3620971A1,JP2021508386A,2021-03-04,ベイジン ディディ インフィニティ テクノロジー アンド ディベロップメント カンパニー リミティッド,Systems and methods for detecting conflicts in the vehicle
EP3620971A1,US11142039B2,2021-10-12,International Business Machines Corporation,In-vehicle adjustment to destination environmental conditions
EP3620972A1,0,0,0,0
EP3621197A1,US10924320B2,2021-02-16,Texas Instruments Incorporated,IQ mismatch correction module
EP3623417B1,0,0,0,0
EP3623724A1,CN111486531A,2020-08-04,华信咨询设计研究院有限公司,Multi-source step heat exchange method
EP3623727A1,0,0,0,0
EP3624122A1,US11074946B2,2021-07-27,Nxp B.V.,Temperature dependent voltage differential sense-amplifier
EP3624357A1,US11211694B2,2021-12-28,Nxp B.V.,Near-field wireless device
EP3624357A1,US11115069B2,2021-09-07,Nxp B.V.,Near-field wireless device for distance measurement
EP3624357A1,US11108436B1,2021-08-31,Nxp B.V.,Near-field wireless device
EP3624357A1,US11038556B1,2021-06-15,Nxp B.V.,Near-field communications device
EP3624357A1,US11108437B1,2021-08-31,Nxp B.V.,Near-field communications device
EP3626123A3,EP3378350B1,2020-05-06,Rol Ergo AB,Telescopic column with internal cable
EP3626123A3,CN110051116A,2019-07-26,江苏捷尔特智能气动系统有限公司,Synchronous lifter and same table
EP3626123A3,USD933404S1,2021-10-19,Dedee R. Dart,Adjustable shelf
EP3626123A3,USD932818S1,2021-10-12,Dedee R. Dart,Adjustable shelf
EP3626123A3,USD898489S1,2020-10-13,Dedee Dart,Adjustable shelf
EP3627044B1,CN212390134U,2021-01-22,漳州立达信光电子科技有限公司,"Light source module, bulb lamp and lamp"
EP3627105A2,US10834523B1,2020-11-10,"Accelerate Labs, Llc","Identification of delivery zones for autonomous vehicles, rovers, and drones"
EP3627105A2,US11105921B2,2021-08-31,Honeywell International Inc.,Systems and methods for vehicle navigation
EP3627105A2,WO2020197417A1,2020-10-01,Kiwirail Limited,Rail tunnel transit system for unmanned aerial vehicles
EP3627105A3,US10834523B1,2020-11-10,"Accelerate Labs, Llc","Identification of delivery zones for autonomous vehicles, rovers, and drones"
EP3627105A3,US11105921B2,2021-08-31,Honeywell International Inc.,Systems and methods for vehicle navigation
EP3627105A3,WO2020197417A1,2020-10-01,Kiwirail Limited,Rail tunnel transit system for unmanned aerial vehicles
EP3627552A1,0,0,0,0
EP3627619A1,0,0,0,0
EP3628336A1,0,0,0,0
EP3629038A1,EP3734465B1,2021-11-03,Nxp B.V.,Data transmission code and interface
EP3629038A1,CN112882423B,2021-10-15,深圳市航顺芯片技术研发有限公司,"Singlechip, singlechip control method and device, intelligent terminal and storage medium"
EP3629249A1,US10769310B2,2020-09-08,Nxp B.V.,Method for making a machine learning model more difficult to copy
EP3629249A1,EP3910555A1,2021-11-17,Infineon Technologies AG,Neural network security
EP3629391A1,US10770539B2,2020-09-08,Nxp B.V.,Fingered capacitor with low-K and ultra-low-K dielectric layers
EP3632203B1,0,0,0,0
EP3632507B1,US10478635B1,2019-11-19,"Joovv, Inc.",Photobiomodulation therapy systems and methods
EP3632507B1,US20210290154A1,2021-09-23,Lumenis Ltd.,Method and system for determining an optimal set of operating parameters for an aesthetic skin treatment unit
EP3632507B1,GB202008034D0,2020-07-15,I Smart Marketing Svcs Ltd,Electromagnetic radiation apparatus
EP3632507B1,CN112717282A,2021-04-30,重庆翰恒医疗科技有限公司,Light diagnosis and treatment device and full-automatic light diagnosis and treatment system
EP3632507B1,CN113040712A,2021-06-29,歌尔科技有限公司,"Jaundice detection device, equipment and storage medium"
EP3632630A1,0,0,0,0
EP3633867A2,US11211694B2,2021-12-28,Nxp B.V.,Near-field wireless device
EP3633867A2,US11115069B2,2021-09-07,Nxp B.V.,Near-field wireless device for distance measurement
EP3633867A2,US20210250065A1,2021-08-12,Nxp B.V.,Near-field electromagnetic induction (nfemi) antenna
EP3634091B1,0,0,0,0
EP3634774A1,0,0,0,0
EP3634774B1,0,0,0,0
EP3636329B1,0,0,0,0
EP3640587A1,WO2022000755A1,2022-01-06,济南浪潮高新科技投资发展有限公司,"Robot, motion control method and apparatus therefor, and computer-readable storage medium"
EP3640913A1,US11004334B2,2021-05-11,Here Global B.V.,"Method, apparatus, and system for automatic verification of road closure reports"
EP3640913A1,US11049390B2,2021-06-29,Here Global B.V.,"Method, apparatus, and system for combining discontinuous road closures detected in a road network"
EP3640913A1,US11222531B2,2022-01-11,Here Global B.V.,"Method, apparatus, and system for providing dynamic window data transfer between road closure detection and road closure verification"
EP3642844A1,0,0,0,0
EP3643629A1,NL2021786B1,2020-05-14,Jbt Food & Dairy Systems B V,An aseptic packaging machine with a collector cup for a sterilizer-nozzle assembly
EP3643630A1,WO2022024155A1,2022-02-03,Universal Pack S.R.L.,"Delivery unit for an aseptic packaging machine, aseptic packaging machine and sterilization method"
EP3643630A1,WO2022024157A1,2022-02-03,Universal Pack S.R.L.,Method to sterilize a packaging machine
EP3643630A1,NL2021787B1,2020-05-14,Jbt Food & Dairy Systems B V,A sterilizer-filler nozzle assembly for an aseptic packaging machine
EP3643630A1,CN112320742A,2021-02-05,张家港市万金机械有限公司,Canned container sterilization apparatus for canning machine
EP3643630B1,NL2021787B1,2020-05-14,Jbt Food & Dairy Systems B V,A sterilizer-filler nozzle assembly for an aseptic packaging machine
EP3643630B1,WO2022024155A1,2022-02-03,Universal Pack S.R.L.,"Delivery unit for an aseptic packaging machine, aseptic packaging machine and sterilization method"
EP3643630B1,WO2022024157A1,2022-02-03,Universal Pack S.R.L.,Method to sterilize a packaging machine
EP3643630B1,CN112320742A,2021-02-05,张家港市万金机械有限公司,Canned container sterilization apparatus for canning machine
EP3643749B1,EP3730549A1,2020-10-28,SABIC Global Technologies B.V.,Scratch resistant pmma and polycarbonate-siloxane copolymer compositions
EP3645935A1,US11189770B2,2021-11-30,Andrey Zykin,LS grid core LED connector system and manufacturing method
EP3646838A2,0,0,0,0
EP3647611A1,0,0,0,0
EP3647670A1,0,0,0,0
EP3647988A1,0,0,0,0
EP3647988B1,0,0,0,0
EP3648000A1,US20210056317A1,2021-02-25,"Micron Technology, Inc.",Advanced driver-assistance system (adas) operation utilizing algorithmic skyline detection
EP3648483A2,0,0,0,0
EP3648934A1,0,0,0,0
EP3649993A1,0,0,0,0
EP3654254A1,US11122424B1,2021-09-14,"Hood Mountain, LLC","Systems, methods and apparatus for data privacy protection based on geofence networks"
EP3654265A1,WO2022025862A1,2022-02-03,"Hewlett-Packard Development Company, L.P.",Individual text determination
EP3654530B1,0,0,0,0
EP3657281A1,0,0,0,0
EP3657681A1,JP2021044732A,2021-03-18,株式会社東芝,"Semiconductor integrated circuit, a/d converter, delta sigma-type a/d converter, incremental delta sigma-type a/d converter, and switched capacitor"
EP3657907A1,US11011815B2,2021-05-18,Texas Instruments Incorporated,Circularly-polarized dielectric waveguide launch for millimeter-wave data communication
EP3659794A1,0,0,0,0
EP3660457A2,0,0,0,0
EP3660533A1,0,0,0,0
EP3660737A1,KR102206834B1,2021-01-25,네이버랩스 주식회사,Method and system for detecting changes in road-layout information
EP3660858A1,GB201801501D0,2018-03-14,Siemens Healthcare Ltd,Mechanical activation computation from fluoroscopy for guided cardiac resynchronization therapy
EP3662780A1,0,0,0,0
EP3663718A1,DE102020206356A1,2021-11-25,Robert Bosch Gesellschaft mit beschränkter Haftung,Method for determining a starting position of a vehicle
EP3663718A1,DE102016213782A1,2018-02-01,Volkswagen Aktiengesellschaft,"A method, apparatus and computer readable storage medium having instructions for determining the lateral position of a vehicle relative to the lanes of a lane"
EP3663718A1,CN112861833B,2021-08-31,禾多科技（北京）有限公司,"Vehicle lane level positioning method and device, electronic equipment and computer readable medium"
EP3663718A1,CN113362488B,2021-10-15,智联万维科技有限公司,OBD monitoring data processing system
EP3663973A1,0,0,0,0
EP3667235A1,US11199415B2,2021-12-14,"Lyft, Inc.",Systems and methods for estimating vehicle position based on contextual sensor information
EP3667235A1,CN113252049A,2021-08-13,中移智行网络科技有限公司,Vehicle distance determining method and device
EP3667891B1,CN111371443B,2020-08-28,上海南麟电子股份有限公司,Active rectifier bridge circuit and on-chip integrated system
EP3667891B1,US11239698B1,2022-02-01,"Medtronic, Inc.",Digitally timed CMOS rectifier for wireless power transfer
EP3669122A1,0,0,0,0
EP3669943B1,0,0,0,0
EP3670715A1,WO2021134481A1,2021-07-08,"Elkem Silicones Shanghai Co., Ltd.",Soluble support materials for additive manufacturing
EP3671124B1,0,0,0,0
EP3671411A2,US11082535B2,2021-08-03,Here Global B.V.,Location enabled augmented reality (AR) system and method for interoperability of AR applications
EP3671411A2,KR20200120973A,2020-10-23,현대자동차주식회사,"Infotainment apparatus of vehicle, and control method for the same"
EP3671523A2,0,0,0,0
EP3671545A1,US11023745B2,2021-06-01,"Beijing Didi Infinity Technology And Development Co., Ltd.",System for automated lane marking
EP3671545A1,US11087173B2,2021-08-10,"Beijing Didi Infinity Technology And Development Co., Ltd.",Using image pre-processing to generate a machine learning model
EP3671545A1,US10990815B2,2021-04-27,"Beijing Didi Infinity Technology And Development Co., Ltd.",Image pre-processing in a lane marking determination system
EP3671545A1,EP3690704B1,2021-02-24,Accenture Global Solutions Limited,Distributed and self-validating dense object detection in digital images
EP3671545A1,US20220036069A1,2022-02-03,GM Global Technology Operations LLC,Detecting road edges by fusing aerial image and telemetry evidences
EP3671545A1,WO2022031228A1,2022-02-10,Grabtaxi Holdings Pte. Ltd,"Method of predicting road attributes, data processing system and computer executable code"
EP3671567A1,0,0,0,0
EP3671623A1,CN113450298B,2022-03-08,国汽智控(北京)科技有限公司,"Multi-sensor-based view map processing method, device and equipment"
EP3672226A2,US11086382B2,2021-08-10,Dell Products L.P.,Compensating for low battery charge levels of a battery in an information handling system
EP3672226A3,US11086382B2,2021-08-10,Dell Products L.P.,Compensating for low battery charge levels of a battery in an information handling system
EP3674118B1,0,0,0,0
EP3674509A1,0,0,0,0
EP3674662A1,CN112649813A,2021-04-13,北京星天地信息科技有限公司,"Method for indoor safety inspection of important place, inspection equipment, robot and terminal"
EP3674662A1,CN112819753A,2021-05-18,香港理工大学深圳研究院,"Building change detection method and device, intelligent terminal and storage medium"
EP3674662A1,US20200409373A1,2020-12-31,Robert Bosch Gmbh,System and Method for Generating a Representation of an Environment
EP3674662A1,CN113963319A,2022-01-21,宝马股份公司,Positioning method and positioning device
EP3674667B1,US11035685B2,2021-06-15,Zenuity Ab,Route planning algorithm for efficiently searching through meaningful links within a defined topology
EP3675367A1,CN113078834B,2022-02-18,华中科技大学,Inverter based on digital delta-sigma and PID double-loop control and design method
EP3677185A1,0,0,0,0
EP3677240A1,0,0,0,0
EP3677388A1,0,0,0,0
EP3677393A1,0,0,0,0
EP3677646B1,0,0,0,0
EP3677651A1,0,0,0,0
EP3678136A1,0,0,0,0
EP3679778A1,0,0,0,0
EP3679841A1,0,0,0,0
EP3679862A1,0,0,0,0
EP3680387A1,0,0,0,0
EP3680445A1,0,0,0,0
EP3680532A3,0,0,0,0
EP3680533A1,CN112942677A,2021-06-11,上海绿地建设(集团)有限公司,Assembled double-side-plate all-bolt steel connecting beam
EP3680561A1,CN112493836A,2021-03-16,九阳股份有限公司,Method for processing soup food material of air fryer
EP3680562A1,0,0,0,0
EP3680640A1,0,0,0,0
EP3680768A1,0,0,0,0
EP3681046A1,US11178591B2,2021-11-16,"Samsung Electronics Co., Ltd.",Ranging-specific MAC service and PIB attributes for IEEE 802.15.4Z
EP3681046A1,US11190990B2,2021-11-30,"Samsung Electronics Co., Ltd.",Framework and method for dynamic channel selection for IEEE 802.15.4z
EP3681046A1,KR102354119B1,2022-01-21,현대모비스 주식회사,Uwb system
EP3681103B1,US11037435B2,2021-06-15,Nxp B.V.,Radio frequency communication device
EP3682785A1,0,0,0,0
EP3683064A1,0,0,0,0
EP3683273A1,0,0,0,0
EP3683539A1,0,0,0,0
EP3683927A1,0,0,0,0
EP3685739A1,0,0,0,0
EP3685746A1,0,0,0,0
